1,Кузьмина Оксана Ефимовна,2002-08-05,Ж,"к. Карпинск, пр. Тамбовский, д. 78 к. 190, 940742",8 193 580 2531
2,Нонна Ивановна Прохорова,2003-12-12,Ж,"п. Мостовской, ул. Кирова, д. 2, 215942",8 990 483 34 94
3,Евграф Еремеевич Потапов,2010-05-21,М,"клх Ногинск (Моск.), ул. Труда, д. 3, 606658",+7 (211) 421-6149
4,Эрнст Ильич Гусев,1972-09-28,М,"ст. Псков, пр. Циолковского, д. 31 стр. 209, 797022",+7 (344) 438-68-21
5,Михей Бенедиктович Филиппов,2000-02-17,М,"к. Шарья, пр. Мирный, д. 920, 518612",+7 683 397 0382
6,Орест Демьянович Максимов,1976-02-22,М,"п. Тымовское, ш. Черноморское, д. 2/8 стр. 9, 063564",+7 (815) 348-1295
7,Ситникова Агафья Геннадиевна,2007-01-26,Ж,"клх Кандалакша, алл. Хвойная, д. 55, 615185",8 603 511 1482
8,Марфа Юльевна Баранова,1992-12-20,Ж,"г. Яхрома, наб. Дорожная, д. 54 стр. 23, 246281",8 (835) 860-11-71
9,Кира Болеславовна Филатова,1984-09-19,Ж,"г. Мостовской, наб. Кузнецова, д. 6, 087265",8 265 672 94 48
10,Новикова Кира Евгеньевна,1995-03-14,Ж,"ст. Нефтекамск, ш. Шмидта, д. 86 стр. 38, 016084",+7 081 802 74 89
11,Устин Глебович Колесников,2008-07-01,М,"клх Петухово, наб. Транспортная, д. 15 стр. 893, 615638",8 735 023 1742
12,Фаина Робертовна Дорофеева,2019-12-14,Ж,"г. Боровск, ул. Индустриальная, д. 1/3, 414709",8 (358) 943-67-82
13,Нина Константиновна Меркушева,1985-11-21,Ж,"клх Находка, наб. Ульяновская, д. 296 стр. 308, 414627",+74652973072
14,Горбунов Конон Матвеевич,1975-05-23,М,"д. Нурлат, ул. Парижской Коммуны, д. 5 стр. 158, 048659",+75152838930
15,Игорь Ерофеевич Лаврентьев,2022-01-12,М,"п. Глазов, наб. Слободская, д. 406 стр. 1, 108861",8 (885) 681-61-06
16,Лазарева Юлия Михайловна,1979-04-27,Ж,"ст. Оленек, ш. Октября, д. 1 к. 10, 314859",+7 799 890 68 44
17,Евпраксия Натановна Коновалова,2020-02-10,Ж,"клх Курчатов, наб. Пожарского, д. 2 стр. 9, 874179",+7 899 690 8251
18,Людмила Тимуровна Калинина,2011-10-20,Ж,"к. Екатеринбург, пер. Папанина, д. 8/3 к. 7/8, 246634",+7 (633) 779-8254
19,Рожкова Анжелика Архиповна,1979-08-02,Ж,"ст. Александровск, пр. Пожарского, д. 90 к. 1, 871916",8 491 151 60 81
20,Ипполит Иосифович Третьяков,2013-09-15,М,"ст. Оймякон, бул. К.Маркса, д. 8/9, 259152",+77491624938
21,Гурий Димитриевич Калашников,1998-12-24,М,"ст. Златоуст, ш. Геологическое, д. 85, 998274",8 (187) 380-0495
22,Феврония Афанасьевна Молчанова,1972-01-31,Ж,"к. Амурск, наб. Юбилейная, д. 2, 673224",8 (586) 298-9621
23,Прокл Брониславович Сазонов,1973-02-15,М,"клх Анапа, алл. Некрасова, д. 68 стр. 595, 460591",8 (226) 752-55-05
24,Самсон Владиславович Потапов,1970-02-12,М,"д. Майкоп, бул. Боровой, д. 44 к. 809, 231401",8 215 467 5370
25,Глеб Юлианович Шарапов,2020-07-24,М,"с. Алексин, наб. Островского, д. 2 стр. 8, 109354",+7 (612) 059-65-46
26,Гедеон Евстигнеевич Пахомов,2002-01-15,М,"д. Мураши, ш. Машиностроителей, д. 8 стр. 4, 490069",8 (387) 718-5010
27,Фаина Федоровна Мишина,1994-03-08,Ж,"к. Красная Поляна, ш. Родниковое, д. 96 стр. 69, 467649",8 108 547 8460
28,Гедеон Борисович Горбунов,1987-09-26,М,"ст. Хабаровск, ш. Кедровое, д. 704 к. 64, 492405",+7 071 117 03 50
29,Куликов Изяслав Владленович,2002-11-26,М,"г. Катав-Ивановск, бул. Шевченко, д. 823 к. 747, 695943",+7 314 468 44 87
30,Елена Артемовна Ефимова,1990-02-01,Ж,"ст. Двинской, пр. Журавлева, д. 29 стр. 84, 838868",+7 (048) 318-88-27
31,Василиса Александровна Орехова,2007-02-02,Ж,"г. Верхний Уфалей, бул. Парижской Коммуны, д. 326 к. 23, 714742",88638687820
32,Наум Елизарович Ситников,1983-07-18,М,"с. Орск, бул. Советской Армии, д. 9/1, 205689",8 455 333 9551
33,Алла Николаевна Тарасова,1988-07-15,Ж,"с. Южноуральск, пр. Надежды, д. 88 стр. 519, 448172",+7 (930) 299-25-20
34,Беспалов Герман Гертрудович,2016-05-31,М,"ст. Кедровый, алл. Докучаева, д. 88 к. 360, 558613",8 282 429 26 51
35,Октябрина Леонидовна Прохорова,2023-09-14,Ж,"к. Усть-Ордынский, наб. Пограничная, д. 668, 303441",81141177358
36,Юлия Вениаминовна Фокина,2014-02-04,Ж,"г. Псебай, ш. Маркса, д. 3/1, 963993",+7 479 637 52 70
37,Гурьева Маргарита Оскаровна,2008-01-09,Ж,"д. Инта, пр. Казанский, д. 5/9 стр. 69, 354221",+75328786121
38,Юлия Дмитриевна Кондратьева,1976-05-13,Ж,"г. Арсеньев, ш. Пирогова, д. 7/6, 291733",8 535 415 8758
39,Вероника Николаевна Мельникова,2021-01-16,Ж,"к. Верещагино (Перм.), пер. Морской, д. 1/8 стр. 5/8, 955772",8 (907) 456-1399
40,Белякова Агата Кирилловна,2005-06-11,Ж,"к. Минусинск, ш. Советов, д. 1/9, 924482",+79925795097
41,Васильев Иосиф Артурович,1983-05-03,М,"д. Тамбов, наб. Волкова, д. 5 стр. 405, 114337",8 703 863 90 96
42,Кузьма Дорофеевич Терентьев,1981-07-27,Ж,"ст. Сеймчан, ул. Рабочая, д. 4/7 к. 5/9, 154627",+7 (099) 343-11-23
43,Котов Аркадий Терентьевич,2018-05-21,М,"д. Дагомыс, ул. Ульяновская, д. 432, 712912",8 (593) 722-33-91
44,Ерофей Филатович Кузьмин,2000-05-20,М,"д. Верхоянск, пр. Красноярский, д. 2/8 к. 453, 209808",+7 (704) 857-4686
45,Гуляева Анжела Сергеевна,2001-10-06,Ж,"к. Волгоград, ул. Докучаева, д. 807 стр. 6, 822848",89024934022
46,Лидия Леоновна Соболева,2014-05-01,Ж,"д. Тавда, бул. Добролюбова, д. 4/4 к. 12, 848915",+7 (011) 772-2950
47,Калашников Никандр Богданович,2012-03-28,М,"ст. Шатки, бул. Цветочный, д. 1/7 к. 8/2, 054552",8 (621) 604-1020
48,Максимильян Иларионович Дорофеев,1996-06-29,М,"к. Щельяюр, бул. Заводской, д. 82, 101026",+70329366684
49,Архипова Наина Вячеславовна,1999-12-06,Ж,"к. Павловский Посад, наб. Коминтерна, д. 191, 103374",+7 372 355 2159
50,Филиппова Прасковья Оскаровна,1972-08-07,Ж,"с. Кострома, пер. Звездный, д. 511 к. 763, 460733",+7 (798) 892-7426
51,Лидия Семеновна Баранова,2014-09-02,Ж,"п. Тамбей, наб. Заозерная, д. 6/2 стр. 1/6, 652837",+7 (868) 169-7746
52,Павлова Нинель Георгиевна,1984-07-29,Ж,"д. Березники, алл. Курортная, д. 3 к. 2, 068299",84418731639
53,Лора Матвеевна Симонова,2007-01-18,Ж,"клх Касимов, пр. Тургенева, д. 9, 267092",+72911900700
54,Евсеева Антонина Васильевна,1995-10-10,Ж,"г. Коломна, пер. Трудовой, д. 95 к. 2, 779717",+7 990 883 27 64
55,Нинель Игоревна Филатова,2009-08-29,М,"к. Мончегорск, пр. Выгонный, д. 835, 204808",8 (477) 946-73-51
56,Куприян Феодосьевич Панфилов,1984-07-10,М,"г. Суздаль, пр. Леонова, д. 6/4 стр. 1/8, 671799",+7 (319) 366-71-41
57,Ананий Артемьевич Воронов,2004-12-25,М,"г. Урус-Мартан, ул. Специалистов, д. 615 стр. 2, 900580",81426498568
58,Анжелика Алексеевна Фролова,2006-08-11,Ж,"п. Хасан, наб. Коммунальная, д. 69 стр. 23, 649513",+7 128 832 6663
59,Гостомысл Ааронович Лобанов,1982-03-13,М,"с. Саранск, ш. Комсомольское, д. 6 к. 872, 656351",+7 656 226 7074
60,Жанна Андреевна Белова,2017-06-14,Ж,"ст. Саранск, алл. Хуторская, д. 14 к. 855, 320689",8 (903) 410-2449
61,Лыткина Акулина Тимуровна,1999-01-31,Ж,"к. Таганрог, пр. Алтайский, д. 3/3 стр. 7/7, 426785",8 999 159 58 15
62,Евдокимова Жанна Егоровна,2022-02-14,Ж,"г. Оха, пер. Запрудный, д. 20, 509374",+78324830100
63,Аким Архипович Симонов,1975-01-11,М,"ст. Добрянка, алл. Мира, д. 65 стр. 9/7, 077952",+7 223 709 3637
64,Евпраксия Олеговна Сорокина,1998-08-06,Ж,"с. Усть-Ишим, бул. Балтийский, д. 500 стр. 3/2, 867677",88639342419
65,Овчинников Федот Харлампович,2009-09-11,М,"п. Карабулак, бул. Ручейный, д. 6, 962514",+71805076581
66,Анисимов Панфил Захарьевич,2008-03-10,М,"д. Урюпинск, бул. Стахановский, д. 5/7, 860083",8 122 735 42 07
67,Софрон Андреевич Соболев,1986-06-25,М,"п. Сосьва (Хант.), ул. Ульяновская, д. 6/6 стр. 6, 285807",+7 (804) 259-57-04
68,Евгения Архиповна Борисова,1986-02-21,Ж,"с. Луховицы, пер. Транспортный, д. 7/3, 712312",8 450 069 08 59
69,Светлана Тимофеевна Артемьева,1990-06-01,Ж,"клх Тутончаны, алл. Декабристов, д. 4/9, 135393",+7 (320) 033-50-61
70,Аггей Виленович Савин,1972-08-11,М,"клх Октябрьское (Челяб.), пр. Водников, д. 9/1, 986669",+7 (399) 465-5363
71,Красильников Мефодий Изотович,2018-09-29,М,"с. Каргополь, ш. Тепличное, д. 9 к. 31, 756417",+79140962638
72,Валентина Васильевна Евдокимова,2015-11-10,Ж,"п. Губкин, бул. Прохладный, д. 28 стр. 2/3, 123551",+7 585 228 2537
73,Константинова Пелагея Сергеевна,1980-10-28,Ж,"к. Печенга, пр. Карбышева, д. 52 стр. 553, 353795",84140777677
74,Зоя Степановна Фадеева,2000-08-17,Ж,"с. Томпа, ул. Фестивальная, д. 9 к. 5, 220431",8 861 762 58 86
75,Потапова Таисия Даниловна,2017-03-12,Ж,"п. Асино, алл. Раздольная, д. 8 стр. 3/5, 967667",8 (967) 081-84-95
76,Евгения Рубеновна Филиппова,1972-06-09,Ж,"ст. Туапсе, ул. 8 Марта, д. 77 к. 907, 576737",80859360476
77,Муравьева Евпраксия Архиповна,1982-04-26,Ж,"г. Тулпан, наб. Механическая, д. 84, 004821",+79252167869
78,Евдокия Евгеньевна Якушева,1981-08-19,Ж,"к. Певек, ул. Хуторская, д. 9 стр. 5, 578510",82123423511
79,Карпова Агата Артемовна,1993-03-29,Ж,"г. Шелехов, бул. Вахитова, д. 46 к. 8, 667719",8 422 954 84 45
80,Александр Демьянович Уваров,2010-07-27,М,"ст. Касимов, ш. 8-е Марта, д. 9, 688655",8 464 079 4488
81,Герасим Фёдорович Шубин,2002-02-19,М,"ст. Ишим, пр. Мира, д. 9/7 к. 908, 979885",+7 627 740 5698
82,Павлова Ия Ниловна,1994-08-29,Ж,"д. Ведено, наб. Пархоменко, д. 1 к. 8, 298953",8 190 783 1252
83,Дроздова Евпраксия Филипповна,1974-08-13,Ж,"д. Находка, наб. Ульяновская, д. 585 стр. 7, 406274",8 (645) 912-60-97
84,Бирюков Станимир Демьянович,1997-12-04,М,"г. Джейрах, ш. Санаторное, д. 753 к. 277, 637383",8 (793) 553-43-26
85,Юлиан Еремеевич Мишин,1992-05-10,М,"д. Дивногорск, алл. Центральная, д. 7 стр. 3/1, 078812",+7 (550) 005-23-39
86,Венедикт Валентинович Лапин,1979-08-29,М,"клх Звенигород, ш. 9 мая, д. 837 к. 7/1, 549228",8 (820) 008-2073
87,Анна Григорьевна Селиверстова,1989-12-20,Ж,"г. Макушино, ш. Озерное, д. 170 к. 530, 632595",+7 597 055 73 32
88,Варлаам Харламович Максимов,1977-02-18,М,"к. Петушки, пер. Пролетарский, д. 4 стр. 56, 915114",8 (292) 633-22-30
89,Исакова Нина Константиновна,1998-01-06,Ж,"с. Каменск-Шахтинский, ул. Заозерная, д. 3/4 к. 8, 111431",+7 066 048 2088
90,Лаврентьев Милий Исидорович,1989-08-14,М,"с. Саратов, пер. Коммуны, д. 4 к. 5, 654824",+7 227 232 4072
91,Евгения Макаровна Самсонова,1976-01-11,Ж,"клх Якутск, ул. Элеваторная, д. 86 стр. 7/4, 679423",8 (981) 930-70-14
92,Карл Борисович Соловьев,1973-08-09,М,"г. Шелехов, ул. Социалистическая, д. 3, 907835",+7 (465) 772-8839
93,Новиков Мокей Владленович,2005-11-23,М,"ст. Вязьма, наб. Горная, д. 95 к. 33, 886399",8 (638) 510-6704
94,Нина Богдановна Комиссарова,1976-11-15,Ж,"с. Онега, пр. Красный, д. 9, 509323",89924053331
95,Ангелина Николаевна Ефимова,2002-01-02,Ж,"к. Малгобек, пер. Олимпийский, д. 27 к. 563, 694387",8 (367) 406-10-40
96,Самойлов Виктор Иларионович,1980-09-29,М,"клх Урай, алл. Нагорная, д. 218, 115564",+71277730781
97,Исакова Акулина Васильевна,2001-10-14,Ж,"д. Апшеронск, пер. Ленинградский, д. 44 к. 450, 234785",+7 (959) 250-6268
98,Ефимов Назар Фёдорович,1997-05-29,М,"с. Холмогоры, наб. Горная, д. 69 стр. 3, 039737",8 864 431 49 01
99,Шашков Евдоким Юлианович,1972-01-19,М,"д. Нарьян-Мар, пр. Заовражный, д. 269, 305720",8 114 095 80 64
100,Анжела Николаевна Власова,2013-02-26,Ж,"г. Астрахань, ш. Крымское, д. 591, 500788",8 (071) 000-0529
101,Сысоева Клавдия Захаровна,2017-06-30,Ж,"клх Белокуриха, ул. 9 Января, д. 656 к. 8, 766108",+7 (345) 875-4412
102,Овчинников Матвей Изотович,2013-10-24,М,"д. Бугуруслан, пер. Трудовой, д. 123, 253164",+7 (771) 747-94-46
103,Харлампий Чеславович Пономарев,2017-12-22,М,"ст. Бронницы, пер. Радужный, д. 814 стр. 638, 872119",+7 (880) 993-64-91
104,Тимофеева Евгения Аскольдовна,1981-02-11,Ж,"клх Гаврилов-Ям, ш. Мира, д. 4/6, 210504",+73758037854
105,Федосеева Тамара Евгеньевна,1988-09-29,Ж,"д. Внуково (метеост.), ул. Лазурная, д. 4 к. 74, 852541",8 (752) 691-1432
106,Ковалева Синклитикия Артемовна,2014-07-16,Ж,"п. Джейрах, алл. Октября, д. 45, 105001",+7 209 374 0562
107,Ратибор Адрианович Устинов,2013-11-18,М,"п. Тура, пер. 40 лет Победы, д. 11, 673234",+7 (825) 327-60-91
108,Фома Марсович Козлов,1987-09-01,Ж,"г. Краснодар, ш. 50 лет ВЛКСМ, д. 609, 710649",8 732 677 0247
109,Октябрина Рудольфовна Копылова,1980-09-29,Ж,"г. Енисейск, бул. Тихий, д. 99 к. 8, 725791",8 960 859 25 72
110,Фаина Богдановна Кондратьева,2012-11-30,Ж,"клх Билибино, пр. Братский, д. 237 к. 4/2, 664355",89473689945
111,Лапин Ипатий Августович,1973-01-07,М,"г. Гремячинск (Бурят.), ул. Безымянная, д. 6 стр. 7, 586750",8 (928) 390-2020
112,Емельянова Людмила Ефимовна,1990-02-24,Ж,"ст. Шуя, пер. Радужный, д. 167 к. 494, 074802",8 (972) 769-46-33
113,Жданов Ярополк Владленович,1972-05-31,М,"к. Объячево, наб. Школьная, д. 38, 771116",8 429 007 70 33
114,Полякова Анжела Станиславовна,1972-04-24,Ж,"клх Макушино, пр. Кольцова, д. 6, 084753",+7 (645) 332-57-16
115,Гуляева Валентина Рубеновна,1975-11-14,Ж,"п. Хасан, наб. Кузнечная, д. 98 к. 8, 351654",+7 (957) 941-7267
116,Ипполит Изотович Дроздов,1981-09-25,М,"г. Лагань, пр. Пионерский, д. 139, 924473",+7 (101) 790-2303
117,Журавлева Татьяна Геннадиевна,1978-04-27,Ж,"клх Диксон, алл. Вахитова, д. 45 к. 30, 753000",+77531119594
118,Белозерова Анна Максимовна,1985-08-11,Ж,"г. Семлячики, ш. Ягодное, д. 7, 603088",+7 470 311 34 81
119,Конон Авдеевич Максимов,2002-10-21,М,"клх Жигулевск, бул. Березовый, д. 8 к. 88, 969768",87518130582
120,Новиков Евстигней Яковлевич,1985-03-09,М,"ст. Алексин, ш. Коммуны, д. 7/4, 467655",8 (098) 174-82-47
121,Тимофей Фёдорович Жданов,1982-08-22,М,"г. Дивногорск, бул. Украинский, д. 50, 045841",+78147977697
122,Гордеев Глеб Ефимович,2000-08-28,М,"клх Терскол, пер. Чайковского, д. 54 к. 54, 357348",8 (761) 040-0029
123,Пимен Эдгардович Горшков,2020-11-14,М,"д. Арсеньев, алл. Средняя, д. 75 стр. 1/6, 593427",8 982 604 91 86
124,Елизавета Филипповна Козлова,2019-02-10,Ж,"с. Мокшан, бул. Терешковой, д. 1/4, 093163",+76644486996
125,Щукина Агата Георгиевна,2012-08-09,Ж,"ст. Миасс, ш. 30 лет Победы, д. 6 к. 6, 840587",8 768 370 85 47
126,Дарья Сергеевна Мухина,1987-10-31,Ж,"клх Лысьва, пр. Морозова, д. 629 стр. 6/2, 876531",+7 296 490 8753
127,Кононова Любовь Максимовна,1991-01-07,Ж,"с. Усть-Катав, ул. Авиационная, д. 342 к. 5, 235635",8 431 645 9521
128,Уваров Иларион Владленович,2013-03-21,М,"г. Обоянь, пр. Кузнецкий, д. 56, 926408",+7 (814) 047-3334
129,г-жа Смирнова Таисия Ждановна,1994-06-13,Ж,"клх Истра, ш. Механизаторов, д. 30 к. 3, 735197",8 (652) 835-8403
130,Воробьев Исидор Даниилович,1978-05-27,М,"с. Кулунда, алл. Снежная, д. 921, 674066",+7 (561) 707-02-78
131,Беляева Нина Александровна,1993-03-30,Ж,"д. Муром, ш. Шахтерское, д. 137, 964342",+7 550 748 99 49
132,Евдокия Андреевна Горшкова,1999-12-16,Ж,"к. Саров (Морд.), ш. Вишневое, д. 602, 589998",8 589 321 2209
133,Кондратьева Жанна Станиславовна,1972-07-02,Ж,"г. Елабуга, бул. 9 Января, д. 6/3 стр. 47, 355265",8 215 144 4222
134,Абрамова Валентина Константиновна,1981-12-09,Ж,"клх Томск, пер. Байкальский, д. 70 к. 1/2, 915970",+7 (368) 280-4994
135,Татьяна Рубеновна Белоусова,2020-10-18,Ж,"д. Сарапул, бул. Железнодорожный, д. 322, 056053",+7 (848) 308-2427
136,Титов Милен Елисеевич,2003-08-06,М,"п. Бомнак, алл. Сосновая, д. 8 стр. 175, 683512",8 (741) 486-5465
137,Никифор Федосеевич Гущин,2010-03-07,М,"д. Тула, пр. Стадионный, д. 140 к. 8/3, 218250",+71518370973
138,Комиссаров Назар Александрович,2021-11-15,М,"с. Сусуман, наб. Брянская, д. 36, 220164",+74238602976
139,Молчанова Валерия Владиславовна,2021-09-21,Ж,"д. Терскол, пр. Заовражный, д. 213, 124215",+79659916017
140,Денисова Антонина Григорьевна,2001-08-14,Ж,"ст. Гусь-Хрустальный, ул. Высотная, д. 8/4 стр. 1, 761851",8 193 623 9995
141,Киселев Ярополк Елизарович,1974-10-05,М,"г. Далматово, наб. Сиреневая, д. 1 к. 37, 899940",+7 646 408 6683
142,Сильвестр Тарасович Щукин,2011-08-20,М,"клх Амурск, бул. Владимирский, д. 96 стр. 4/8, 698798",8 (973) 306-98-39
143,Татьяна Федоровна Симонова,2009-08-30,Ж,"п. Усть-Кулом, пер. Подлесный, д. 5/7, 701744",8 266 158 6221
144,Майя Аскольдовна Михеева,2009-01-12,Ж,"д. Тайшет, ул. Свободная, д. 81, 767636",8 (983) 611-80-63
145,Сорокина Акулина Романовна,1998-04-04,Ж,"к. Карабулак, бул. Чехова, д. 7, 033988",8 827 392 08 24
146,Антонина Болеславовна Артемьева,2004-06-13,Ж,"ст. Томпа, наб. Сплавная, д. 3 стр. 9, 275036",+7 (762) 231-4392
147,Алевтина Игоревна Ершова,2017-05-14,Ж,"клх Ялуторовск, бул. Пионерский, д. 6/9, 915642",+77518636996
148,Тимофеева Жанна Валериевна,1986-06-30,Ж,"д. Сосногорск, ш. Казачье, д. 6 к. 8, 382637",+7 (540) 430-3858
149,Аполлинарий Валерьянович Самойлов,2021-07-01,М,"г. Шумиха, ул. Ильича, д. 31, 803142",+7 (066) 116-9990
150,Доронин Милен Ермилович,1987-07-16,М,"г. Верхнее Пенжино, алл. Западная, д. 80 стр. 2/8, 660278",+77631963193
151,г-н Игнатьев Натан Исидорович,2018-09-06,М,"п. Малоярославец, бул. Лесхозный, д. 2/6, 095257",8 (469) 704-22-49
152,Агата Леоновна Костина,2006-07-04,Ж,"к. Туруханск, пер. 8 Марта, д. 1/9, 426013",86381635059
153,Мокей Ильясович Зиновьев,1996-01-30,М,"с. Туруханск, наб. Циолковского, д. 6/4 к. 3/3, 887371",80786076894
154,Филарет Иосифович Пестов,1991-06-06,М,"п. Палана, пр. Почтовый, д. 69 к. 435, 393359",8 (448) 841-3913
155,Моисеева Агафья Аскольдовна,2002-01-24,Ж,"с. Волоколамск, ш. 50 лет ВЛКСМ, д. 798, 107362",89095777116
156,Мамонтов Мефодий Ильясович,2010-04-17,М,"к. Ишим, алл. Автомобилистов, д. 109, 297286",8 068 582 49 73
157,Евдокия Макаровна Лапина,1984-01-12,Ж,"п. Петропавловск-Камчатский, ул. Победы, д. 1 к. 4/4, 466518",8 893 622 38 05
158,Пахомова Нонна Валериевна,2018-01-17,Ж,"д. Кяхта, бул. Поперечный, д. 270 к. 84, 283138",85943722346
159,Лонгин Данилович Федоров,1999-01-26,М,"ст. Александров Гай, ш. Нагорное, д. 8/4 стр. 310, 838878",8 827 142 05 91
160,Данилов Ермолай Васильевич,2019-02-26,М,"с. Верхоянск, наб. Мостовая, д. 90 стр. 89, 368977",+7 (317) 546-1155
161,Игнатьева Оксана Кузьминична,1988-09-21,Ж,"г. Кузнецк, наб. Бригадная, д. 29 стр. 580, 762976",8 (659) 006-28-66
162,Всеволод Брониславович Кудрявцев,2016-05-05,М,"г. Минусинск, бул. Дружбы, д. 36, 926567",8 (809) 517-1312
163,Ирина Ждановна Устинова,1999-03-31,Ж,"ст. Белореченск, пер. Стахановский, д. 9/6 стр. 9, 948700",8 984 615 6405
164,Орлова Лора Алексеевна,1971-10-01,Ж,"п. Диксон, ул. Молодежная, д. 62 к. 18, 185741",+7 (456) 401-1515
