2589,Панфилова Ия Аскольдовна,1979-06-06,Ж,"д. Ангарск, ул. Мая 1, д. 78, 862000",8 379 266 3448
2590,Зиновий Фомич Баранов,1970-06-16,М,"с. Екатеринбург, бул. Кубанский, д. 39, 028735",+7 868 242 2675
2591,Мечислав Артурович Владимиров,2012-04-30,М,"к. Одинцово, пр. Виноградный, д. 90 к. 1, 258883",89443219740
2592,Дарья Станиславовна Богданова,2020-12-21,Ж,"к. Павловский Посад, пр. Окружной, д. 239 стр. 1, 273581",85733326484
2593,Егорова Татьяна Ильинична,1989-03-23,Ж,"клх Малоярославец, бул. Макаренко, д. 77 к. 4, 067479",82521191610
2594,Шарова Маргарита Архиповна,2005-03-03,Ж,"с. Сасово, алл. Ильича, д. 4 к. 6/1, 204355",8 (404) 117-8275
2595,тов. Чернов Бронислав Брониславович,2000-06-12,М,"клх Североуральск, пр. Путевой, д. 9 стр. 8/7, 177921",+7 (807) 326-76-04
2596,Алла Викторовна Белякова,1982-09-25,Ж,"п. Сургут (Хант.), наб. Парижской Коммуны, д. 664 к. 9, 167693",8 598 860 7493
2597,Лазарев Гедеон Феофанович,2015-08-10,М,"п. Красновишерск, ул. Лазурная, д. 952, 346941",8 867 204 15 37
2598,Воронцова Эмилия Алексеевна,2016-04-07,Ж,"клх Малоярославец, ш. Приозерное, д. 8/1 стр. 53, 050564",+7 (428) 181-1105
2599,Борисов Исидор Харлампьевич,1994-10-09,М,"клх Тутаев, пер. Горького, д. 7 стр. 6/7, 693467",8 (761) 726-11-96
2600,Никанор Богданович Мишин,1978-08-08,М,"г. Киржач, ш. К.Маркса, д. 1/7, 989618",+76878513017
2601,Борисов Савелий Дорофеевич,2017-05-14,М,"д. Соликамск, наб. Коммунистическая, д. 96 к. 9, 501006",+7 158 212 1006
2602,Юдина Прасковья Ивановна,1973-06-06,Ж,"п. Новый Оскол, бул. Украинский, д. 2/7, 355214",8 689 326 39 13
2603,Кононова Прасковья Константиновна,2015-07-04,Ж,"с. Уэлен, пр. Строителей, д. 5/8, 128090",+7 (893) 390-17-17
2604,Устин Филимонович Романов,1996-06-14,М,"д. Слюдянка, наб. Заливная, д. 2/6 к. 97, 329742",8 (191) 303-11-20
2605,Оксана Николаевна Белова,1987-03-23,Ж,"д. Ишим, ш. Звездное, д. 1 стр. 3, 526992",8 (281) 036-01-16
2606,Евфросиния Вадимовна Моисеева,2008-02-17,Ж,"г. Сладково, ш. Октября, д. 6/6 стр. 9, 711690",8 (769) 632-4778
2607,Наталья Афанасьевна Орлова,1977-09-15,Ж,"к. Шерегеш, бул. Фабричный, д. 109, 887047",+7 (240) 986-0075
2608,Надежда Ждановна Брагина,1989-08-24,Ж,"с. Долинск, ш. Клубное, д. 4 к. 7, 308010",+7 046 856 85 58
2609,Алина Кузьминична Дорофеева,1977-10-24,Ж,"клх Медногорск, бул. Логовой, д. 65, 420109",+7 (759) 807-57-27
2610,Прасковья Тимофеевна Шарапова,2021-06-15,Ж,"с. Казань, пр. Привольный, д. 91 к. 641, 580392",+70086628686
2611,Горбачев Серафим Эдуардович,2019-04-04,М,"ст. Белоярский, пер. Ленинградский, д. 605, 536713",+7 566 756 74 18
2612,Эраст Трофимович Кошелев,1997-08-18,М,"к. Калач-на-Дону, бул. Беляева, д. 1/5 к. 332, 022880",+70553567778
2613,Арефий Ефимьевич Пономарев,2023-01-15,М,"г. Истра, пер. Высоковольтный, д. 7/9 стр. 1/4, 107984",+7 (554) 084-65-80
2614,Хохлов Мирослав Геннадиевич,2021-09-08,М,"п. Коломна, ш. Подлесное, д. 2 стр. 6, 281165",8 (463) 176-22-38
2615,Любим Игоревич Исаков,1980-02-14,М,"п. Дубна, ш. 60 лет СССР, д. 16 к. 9/2, 474234",84883366652
2616,Буров Клавдий Игнатович,1984-06-28,М,"к. Буденновск, пр. Иванова, д. 514 к. 9, 629150",+72849043053
2617,Горбунова Наталья Рубеновна,1996-02-23,Ж,"г. Уварово, пер. Севастопольский, д. 6/2 к. 9, 911329",+7 (522) 807-8778
2618,Нонна Альбертовна Емельянова,1976-03-24,Ж,"ст. Сергиев Посад, ул. Первомайская, д. 1, 557688",8 (711) 306-3200
2619,Синклитикия Николаевна Муравьева,1982-09-10,Ж,"п. Кунгур, ул. Жуковского, д. 87 к. 4/6, 840519",+7 114 249 49 38
2620,Людмила Матвеевна Дементьева,1988-06-19,Ж,"г. Кабанск, бул. Дружба, д. 68 к. 7/3, 299246",8 020 395 9441
2621,Парамон Ефстафьевич Соловьев,1971-12-22,М,"г. Челябинск, алл. Безымянная, д. 838 стр. 274, 750078",+7 365 836 15 62
2622,Никифоров Ипат Тихонович,1979-04-15,М,"ст. Магас, ул. Просвещения, д. 3 стр. 25, 035078",+7 101 155 19 15
2623,Татьяна Мироновна Миронова,1975-12-13,Ж,"д. Каменномостский, ул. Стадионная, д. 1/9 стр. 228, 887877",+7 525 389 7657
2624,Петухов Милан Елизарович,2001-05-23,М,"д. Новгород Великий, наб. Максима Горького, д. 943 стр. 609, 889457",85134894684
2625,Галина Викторовна Мартынова,2011-02-25,Ж,"д. Кулунда, ш. Чернышевского, д. 69 стр. 811, 363396",86564780471
2626,Ангелина Эльдаровна Гришина,1974-07-11,Ж,"к. Азов (Рост.), алл. Кузнечная, д. 538, 145860",8 423 867 19 00
2627,Костин Назар Жоресович,1974-12-11,М,"с. Горно-Алтайск, ш. Камское, д. 3 стр. 4, 031903",8 (857) 259-12-46
2628,Лев Феофанович Терентьев,2023-03-22,М,"к. Киров (Вятка), алл. Социалистическая, д. 7/1, 576470",8 570 549 1039
2629,Наина Макаровна Денисова,1971-02-25,Ж,"ст. Нарткала, пер. О.Кошевого, д. 29, 870710",8 (547) 605-82-83
2630,Смирнова Майя Леонидовна,1988-06-11,Ж,"п. Горно-Алтайск, алл. Ключевая, д. 47 к. 4/2, 180010",+7 292 583 5746
2631,Гедеон Всеволодович Громов,2020-12-28,М,"клх Кисловодск, наб. Партизанская, д. 2/4 к. 76, 501678",85086673548
2632,Николаева Олимпиада Алексеевна,2004-04-27,Ж,"с. Кулунда, алл. Набережная, д. 5/3, 604517",8 (676) 598-13-75
2633,Полякова Василиса Константиновна,2022-02-01,Ж,"к. Истра, пр. Декабристов, д. 26 стр. 1/4, 214296",8 377 842 85 49
2634,тов. Маркова Акулина Анатольевна,2004-10-06,М,"п. Верхний Тагил, бул. Торговый, д. 297 к. 4/3, 429067",+7 (450) 992-19-96
2635,Комиссарова Светлана Натановна,1972-07-21,Ж,"ст. Люберцы, пр. Степана Разина, д. 5/7 стр. 29, 615665",8 727 299 3795
2636,Нинель Федоровна Семенова,1995-06-27,М,"д. Тюмень, пер. Химиков, д. 65, 172049",8 (832) 550-6617
2637,Белова Полина Анатольевна,1997-01-21,Ж,"г. Мончегорск, пр. Целинный, д. 8/9 стр. 8, 487738",+72864792044
2638,Ксения Феликсовна Некрасова,2003-04-13,Ж,"д. Хасавюрт, пр. Мельничный, д. 589, 119785",+7 281 342 7235
2639,Иванова Виктория Ждановна,2014-09-30,Ж,"д. Осташков, ш. Авиационное, д. 9/7, 240110",+7 (003) 844-9696
2640,Казакова Валерия Александровна,1977-08-11,Ж,"д. Кандалакша, алл. Коммунаров, д. 1/3, 748258",8 (331) 092-8547
2641,Герасимов Вячеслав Артёмович,2008-10-23,М,"к. Шадринск, бул. Привольный, д. 73 к. 19, 643245",8 247 532 4364
2642,Давыдов Капитон Игоревич,1984-04-16,М,"ст. Сортавала, ш. Сурикова, д. 6 стр. 15, 252310",+78831536767
2643,Мария Сергеевна Субботина,2016-04-22,Ж,"клх Сосновый Бор, алл. Тургенева, д. 114 стр. 6, 649395",89800653181
2644,Котова Мария Михайловна,2006-06-04,Ж,"к. Оленек, ул. Таманская, д. 6/4 стр. 3, 103464",+77384126656
2645,Кулаков Устин Борисович,2002-10-18,М,"д. Благовещенск (Амур.), наб. Шишкина, д. 330 к. 4, 765949",+7 (801) 339-10-38
2646,Надежда Робертовна Мартынова,2006-02-06,Ж,"к. Сузун, ш. Прохладное, д. 966, 978483",8 529 352 47 29
2647,Воронов Парамон Юльевич,1988-12-29,М,"ст. Галич, бул. Громова, д. 96 к. 87, 704842",+7 739 614 7541
2648,Калинин Федот Зиновьевич,1979-09-28,М,"д. Нарым, ул. Сельская, д. 4/5 к. 593, 652084",+7 (177) 609-53-74
2649,Антонина Леонидовна Романова,2000-02-17,Ж,"к. Пятигорск, ул. Пожарского, д. 8 к. 5/5, 130954",+7 029 581 8814
2650,Никитина Агафья Рудольфовна,2018-06-01,Ж,"г. Черусти, наб. Чернышевского, д. 6 стр. 3, 423848",+7 922 945 23 15
2651,Чернов Галактион Архипович,1970-06-05,М,"ст. Белгород, пер. Победа, д. 6/9 к. 434, 126696",+7 285 587 2034
2652,Потапов Сила Васильевич,1995-04-09,М,"п. Инта, ул. Клары Цеткин, д. 695 к. 8, 448840",+7 (383) 892-0422
2653,Елисей Борисович Кудряшов,2006-11-25,М,"к. Дмитров, алл. Пирогова, д. 625 к. 7, 623404",8 721 644 01 19
2654,Лариса Ивановна Королева,1989-11-09,Ж,"ст. Ставрополь, пер. Олега Кошевого, д. 12 стр. 51, 980883",+7 (095) 446-67-93
2655,Агафья Дмитриевна Антонова,1971-12-30,Ж,"г. Пышма, бул. Тополиный, д. 78 к. 40, 751974",+7 (976) 792-2335
2656,Елисей Абрамович Кузьмин,2000-11-03,М,"с. Сибай, алл. Луначарского, д. 8/8 стр. 266, 536919",8 923 934 1273
2657,Лукия Степановна Калашникова,1986-05-02,Ж,"к. Соль-Илецк, наб. Буденного, д. 766 к. 6/4, 221427",+7 (155) 771-52-95
2658,Анна Васильевна Игнатьева,2022-01-16,Ж,"с. Куртамыш, пер. Тельмана, д. 1 стр. 411, 057242",+7 124 771 5122
2659,Елисеев Панфил Артёмович,2005-03-11,М,"клх Якутск, алл. Революционная, д. 375 стр. 9/5, 323234",8 087 563 6395
2660,Назарова Маргарита Александровна,2005-10-24,Ж,"г. Яр-Сале, алл. Аэродромная, д. 227 к. 97, 910529",8 544 394 4781
2661,Крюков Всемил Бориславович,2005-08-25,М,"с. Аршан (Бурят.), пер. Сурикова, д. 1 к. 4, 215242",+7 (935) 580-9569
2662,Элеонора Михайловна Титова,1979-01-09,Ж,"ст. Двинской, пр. Революции, д. 518 к. 5, 958163",8 (794) 510-01-45
2663,Лихачев Лонгин Власович,1997-05-05,М,"клх Шереметьево, бул. Сибирский, д. 53 к. 5, 502715",8 (174) 678-69-03
2664,Титова Нинель Артемовна,2016-12-18,Ж,"с. Южно-Курильск, бул. Ленинградский, д. 65 стр. 8/7, 851030",8 (283) 591-81-39
2665,Лебедева Нинель Викторовна,2006-05-16,Ж,"с. Ижевск, бул. Почтовый, д. 746, 773070",8 (666) 783-9817
2666,Синклитикия Даниловна Жданова,1990-05-06,Ж,"к. Шахты, ул. Ворошилова, д. 2/8, 501752",8 512 181 1212
2667,Любовь Игоревна Коновалова,2009-03-09,М,"г. Кырен, ул. Октябрьская, д. 616, 378092",+7 (992) 755-71-40
2668,Терентьева Алевтина Рубеновна,1994-11-25,Ж,"к. Дно, пер. Войкова, д. 563 к. 1, 803495",+7 214 714 6460
2669,Петрова Галина Святославовна,2019-05-07,Ж,"п. Чайковский, алл. Фадеева, д. 67 к. 6/8, 158261",8 (307) 459-9813
2670,Доброслав Авдеевич Комиссаров,2020-05-10,М,"к. Бологое, пр. Азовский, д. 52, 687507",8 (216) 501-0051
2671,Октябрина Вениаминовна Мартынова,1975-01-13,Ж,"г. Анадырь, пер. Гвардейский, д. 34 к. 4, 907395",8 454 247 17 71
2672,Якушева Фаина Даниловна,1983-03-25,Ж,"г. Холмск, пр. Кирова, д. 365 к. 52, 971002",8 581 838 68 56
2673,Егор Харлампович Воронцов,2007-08-07,М,"д. Шаховская, ул. Осипенко, д. 2/9 стр. 508, 644457",+70168518343
2674,Оксана Игоревна Кузнецова,2022-04-26,Ж,"п. Воткинск, наб. Каштановая, д. 7/7, 371995",+7 (280) 706-88-93
2675,Фадей Владиленович Ермаков,2003-05-01,М,"ст. Ребриха, ул. Прудовая, д. 997 к. 71, 874887",+7 (534) 703-4599
2676,Нинель Юрьевна Евдокимова,1979-03-29,М,"к. Нижний Новгород, наб. Жукова, д. 1/4, 028716",86340557351
2677,Серафим Яковлевич Панов,1982-06-03,М,"д. Палана, бул. Журавлева, д. 9 стр. 5/5, 070695",+7 147 998 3852
2678,Григорьева Тамара Семеновна,1987-11-17,Ж,"ст. Гремячинск (Перм.), алл. Бабушкина, д. 93, 588746",+7 (416) 896-17-56
2679,Пахомова Марина Робертовна,1999-01-26,Ж,"с. Усть-Ордынский, ш. Луговое, д. 7/7 стр. 64, 328602",+7 327 925 6562
2680,Виктория Вениаминовна Князева,2015-05-16,Ж,"п. Сунтар, наб. Шишкина, д. 5 стр. 4/2, 590573",+7 (737) 555-47-80
2681,Артемий Филимонович Белов,1974-07-12,М,"к. Радужный, наб. Кооперативная, д. 403 к. 102, 406320",+74084275980
2682,Фома Ерофеевич Зимин,1986-11-27,Ж,"д. Усмань, алл. Мичурина, д. 106 к. 7, 160579",+7 404 007 17 91
2683,Синклитикия Тимуровна Осипова,2012-07-13,Ж,"д. Красноселькуп, пр. Новгородский, д. 1 стр. 72, 257542",+7 612 060 46 31
2684,Кузьма Захарьевич Лебедев,1994-03-22,Ж,"п. Андреаполь, наб. Болотная, д. 247 стр. 9/2, 353645",8 (690) 589-8290
2685,Феликс Власович Федоров,1986-11-26,М,"п. Ревда (Сверд.), ул. Алтайская, д. 3/9 к. 13, 772100",8 (936) 549-3652
2686,Романов Кузьма Жоресович,1985-06-20,М,"клх Бронницы, пр. Луговой, д. 5/4 к. 35, 837528",+7 (328) 413-06-46
2687,Гаврила Яковлевич Игнатьев,1980-01-08,Ж,"ст. Пышма, бул. Шахтерский, д. 59 стр. 496, 752884",8 148 894 4948
2688,Волков Трифон Денисович,1972-08-12,М,"к. Билибино, бул. Гоголя, д. 912, 939214",+7 406 050 69 67
2689,Таисия Георгиевна Зиновьева,1978-05-02,Ж,"с. Черняховск, ул. Овражная, д. 895 к. 7, 214970",81368526839
2690,Наталья Валериевна Пахомова,2008-12-23,Ж,"д. Черусти, алл. Гоголя, д. 352 стр. 52, 295486",8 556 824 4025
2691,Борисов Евграф Феодосьевич,1999-08-18,М,"ст. Шенкурск, пр. Балтийский, д. 67 к. 87, 566714",+7 (073) 348-2097
2692,Жуков Агафон Ильич,1989-09-29,М,"ст. Липецк, наб. Льва Толстого, д. 62 стр. 321, 753500",8 (025) 622-16-77
2693,София Олеговна Беспалова,2006-09-13,Ж,"клх Нефтекамск, ул. Димитрова, д. 86, 354837",+71007712451
2694,Князев Сидор Викентьевич,1984-11-23,М,"д. Аршан (Бурят.), пер. Энергетиков, д. 9/8 стр. 494, 040333",+7 989 013 1664
2695,Панфил Арсеньевич Смирнов,1989-01-13,М,"п. Кирово-Чепецк, ш. Тульское, д. 7/4 стр. 5, 781914",8 (725) 650-23-03
2696,Терентьев Афиноген Бенедиктович,1987-06-19,М,"клх Алапаевск, пер. Брянский, д. 2, 488316",+77950699809
2697,Комиссарова Ираида Аскольдовна,2003-05-16,Ж,"к. Чусовой, наб. Цветочная, д. 6/9, 120805",+7 (356) 438-6381
2698,Журавлева Олимпиада Оскаровна,1978-03-28,Ж,"к. Эльтон, ш. Энергетиков, д. 18 к. 1, 788102",+7 080 915 9699
2699,Жанна Аркадьевна Князева,2021-01-29,Ж,"клх Мончегорск, алл. Дзержинского, д. 921, 234968",+7 724 847 4678
2700,Эмиль Якубович Фомичев,1986-01-21,М,"д. Москва, ш. Надежды, д. 551, 285749",+7 226 711 64 99
2701,Ирина Ефимовна Ларионова,1997-02-01,Ж,"п. Пинега, ш. Мельничное, д. 18 к. 992, 704474",89974441781
2702,Твердислав Харлампович Селиверстов,2010-10-03,М,"ст. Березники, наб. Верхняя, д. 679 к. 5, 864775",8 436 143 2518
2703,Власов Гурий Фёдорович,2022-04-27,М,"г. Егорьевск, ш. Совхозное, д. 12, 273800",+7 996 164 91 20
2704,Карл Валерьевич Козлов,1984-09-04,М,"ст. Дагомыс, бул. Королева, д. 5/6 к. 1, 157454",+7 301 316 2050
2705,Марков Давыд Григорьевич,1982-10-21,М,"к. Вуктыл, ш. Ростовское, д. 19 стр. 5, 219510",8 (005) 608-8997
2706,Осипов Эрнст Архипович,2005-07-25,М,"с. Октябрьское (Хант.), ул. Металлургов, д. 8/9, 045717",8 (019) 427-07-16
2707,Ершова Дарья Рубеновна,2018-02-21,Ж,"с. Миллерово, ш. Карла Либкнехта, д. 78, 227689",8 (278) 046-5465
2708,Тарасова Дарья Сергеевна,1984-12-06,Ж,"ст. Ревда (Сверд.), алл. Культуры, д. 472 стр. 29, 259342",8 014 796 7672
2709,Максимов Наркис Геннадиевич,1992-06-23,М,"клх Урай, бул. Тенистый, д. 3 к. 7/7, 425460",+78537735379
2710,Гурьев Порфирий Ярославович,2003-11-05,М,"г. Кыштым, ул. Курская, д. 445 стр. 5/5, 106039",8 (875) 719-7319
2711,Селезнева Ирина Болеславовна,2011-05-06,Ж,"д. Петушки, пр. Локомотивный, д. 98 к. 37, 679269",+7 352 917 5438
2712,Каллистрат Федотович Молчанов,1984-07-07,М,"к. Кедровый, ул. Невского, д. 531 к. 5/9, 952440",8 (110) 634-2891
2713,Будимир Арсеньевич Никитин,1990-03-12,М,"клх Иваново, ш. Карла Маркса, д. 749 к. 3, 562575",+7 (883) 744-47-87
2714,Селиверстов Август Даниилович,2021-10-30,М,"к. Ербогачен, ш. Маяковского, д. 9/2 к. 900, 753680",81735055674
2715,Фока Гертрудович Суханов,1998-03-22,Ж,"г. Бавлы, ул. Механическая, д. 567 к. 35, 878189",+7 (845) 452-43-72
2716,Ульяна Даниловна Пахомова,1980-09-13,Ж,"клх Ачхой Мартан, наб. Октября, д. 3 стр. 4/4, 928734",+7 994 179 4244
2717,Таисия Кузьминична Власова,2009-10-12,Ж,"к. Одинцово, пер. Шишкина, д. 98 к. 5/5, 255467",+7 (796) 667-69-85
2718,Терентьева Ангелина Евгеньевна,2003-07-15,Ж,"ст. Якутск, пер. Гагарина, д. 4, 046148",8 571 230 21 92
2719,Никифорова Мария Макаровна,1992-05-29,Ж,"клх Уренгой, ул. Ягодная, д. 1 стр. 6/5, 313167",+7 (046) 289-10-16
2720,Соколова Ульяна Ждановна,1981-12-20,Ж,"клх Пятигорск, наб. Рязанская, д. 97, 597475",+7 (545) 499-3438
2721,Киселева Мария Руслановна,1982-06-16,Ж,"д. Сургут (Хант.), наб. Дорожников, д. 75 стр. 721, 428862",8 884 617 74 22
2722,Милица Игоревна Панфилова,1986-10-06,Ж,"д. Горно-Алтайск, бул. Малиновый, д. 31 стр. 37, 323881",8 502 241 09 45
2723,Самойлов Велимир Димитриевич,2004-09-20,М,"с. Катайск, алл. Крайняя, д. 364, 734387",83860474717
2724,Мельников Роман Андреевич,2006-11-03,М,"г. Ноябрьск, пер. Лесхозный, д. 81, 596396",86348940231
2725,Лукия Захаровна Исаева,2008-06-19,Ж,"ст. Нягань, бул. Авиационный, д. 715, 737484",+7 (932) 541-71-01
2726,Орлов Артем Афанасьевич,1986-06-01,М,"к. Нарьян-Мар, алл. Болотная, д. 5/1, 695108",+7 590 341 91 38
2727,Мишин Викторин Власович,1990-06-29,М,"п. Игарка, наб. Солнечная, д. 7/4, 095883",8 719 030 7150
2728,Арефий Иларионович Александров,1985-09-03,М,"с. Камышин, пр. О.Кошевого, д. 52 стр. 4, 214200",+7 (915) 406-27-51
2729,Ефремов Эрнст Эдгардович,2001-05-06,М,"ст. Шелехов, бул. Лесозаводский, д. 19 стр. 372, 613223",8 167 966 62 10
2730,Ильин Петр Харлампьевич,2019-01-24,М,"ст. Котлас, ш. Элеваторное, д. 7/7 стр. 391, 147744",+7 (602) 192-8313
2731,Пестов Максим Борисович,1971-10-08,М,"клх Ижевск, алл. Курганная, д. 859 стр. 56, 350997",+7 969 917 62 13
2732,Кудряшов Радислав Исидорович,2014-06-19,М,"п. Новомичуринск, наб. Герцена, д. 1 к. 162, 030678",+7 281 734 8490
2733,Софон Фадеевич Савин,2006-04-23,М,"к. Буйнакск, ул. Сплавная, д. 24, 017289",8 728 365 6017
2734,Голубев Радислав Игнатович,1995-10-17,М,"д. Валаам, алл. Короткая, д. 5 к. 118, 816642",+7 (980) 802-3144
2735,Гаврилов Варфоломей Григорьевич,1999-08-15,М,"г. Владивосток, пр. Братский, д. 6 стр. 1/8, 891880",8 019 681 5058
2736,Пелагея Эльдаровна Филатова,1971-01-26,Ж,"с. Ялуторовск, ул. Республиканская, д. 54, 549675",8 (513) 915-4996
2737,Орлов Потап Вилорович,2022-03-07,М,"г. Бреды, бул. Республиканский, д. 85 к. 89, 211409",+7 051 055 98 49
2738,Сазонова Зоя Наумовна,2009-08-13,Ж,"с. Нижнекамск, пр. Сиреневый, д. 4/2 стр. 92, 681120",+7 (066) 863-0334
2739,Савельева Василиса Филипповна,1986-09-12,Ж,"клх Екатеринбург, ш. Высокое, д. 736, 014193",8 115 965 6402
2740,Евдокимова Маргарита Викторовна,1979-07-31,Ж,"г. Сладково, пр. Специалистов, д. 536 стр. 958, 706626",8 (111) 770-7204
2741,Адриан Трифонович Лебедев,2009-05-17,М,"п. Волгоград, бул. Революции, д. 198, 465964",+78870553074
2742,Эмилия Вячеславовна Евсеева,2003-11-17,Ж,"г. Добрянка, ул. Маркса, д. 35, 494467",8 (720) 976-8117
2743,Любим Гавриилович Гурьев,2020-01-15,М,"ст. Уварово, пр. Ягодный, д. 246, 557376",+7 (639) 140-35-39
2744,Лонгин Антонович Сорокин,2001-06-22,М,"г. Тула, пер. Минский, д. 70, 363420",8 (412) 994-3696
2745,Панов Николай Ермилович,1989-03-24,М,"к. Якутск, пр. Проточный, д. 62 стр. 770, 021949",+7 (219) 869-24-48
2746,Валерьян Эдгардович Рожков,1977-02-07,М,"д. Рославль, наб. Леонова, д. 4, 773829",8 567 373 6605
2747,Кабанова Наталья Дмитриевна,2022-08-30,Ж,"ст. Сортавала, ул. Мичурина, д. 38 к. 3, 464741",8 (882) 083-98-31
2748,Иосиф Бенедиктович Комаров,2006-06-26,М,"п. Карабудахкент, наб. Орджоникидзе, д. 70 стр. 9/3, 010918",8 (796) 943-18-49
