1296,Аверьян Августович Вишняков,1998-07-30,М,"д. Анива, алл. Семашко, д. 21, 855091",8 (942) 709-0166
1297,Евпраксия Викторовна Третьякова,2012-10-29,Ж,"клх Красногорск (Моск.), ул. Главная, д. 9/9, 145786",+7 604 179 8588
1298,Майя Вячеславовна Никитина,2006-05-21,Ж,"д. Ростов-на-Дону, пр. Локомотивный, д. 7/8 стр. 6, 410874",8 (215) 318-51-61
1299,Мирослав Владиленович Шилов,1983-05-15,М,"г. Барнаул, ул. Комсомольская, д. 5/8, 340601",+70910962155
1300,Мухина Валерия Вадимовна,2011-12-24,Ж,"д. Котлас, ш. Привокзальное, д. 9/4 к. 7/6, 548339",+7 992 703 0225
1301,Александра Георгиевна Чернова,1978-03-04,Ж,"ст. Валаам, бул. Микрорайон, д. 8/1 стр. 1/9, 422756",8 669 174 4076
1302,Ефрем Викентьевич Зайцев,1998-08-07,М,"д. Чермоз, пер. Мира, д. 6/9, 307231",+7 (034) 839-48-61
1303,Порфирий Тарасович Аксенов,1983-08-07,М,"клх Ростов, ул. Ключевая, д. 7 к. 2/3, 612238",83598288189
1304,Любовь Максимовна Устинова,2008-03-18,М,"ст. Белокуриха, пр. Угловой, д. 2 стр. 6/5, 496403",+7 (616) 071-3442
1305,Жданов Вячеслав Харлампович,2010-11-08,М,"клх Ярославль, ул. Тельмана, д. 100 к. 1, 745053",+76942621510
1306,Любовь Вячеславовна Егорова,1979-05-18,М,"с. Азов (Рост.), алл. Азина, д. 2/3, 239883",+7 (435) 625-26-20
1307,Назарова Милица Натановна,2017-05-22,Ж,"с. Старая Русса, пер. Правды, д. 3 к. 5, 851444",+7 803 360 9687
1308,Лариса Рудольфовна Панфилова,1985-09-01,Ж,"д. Солнечногорск, пер. Каштановый, д. 9/8, 532718",8 (720) 627-1273
1309,Большакова Елизавета Тимуровна,1983-07-12,Ж,"с. Киржач, ш. Дружба, д. 24 к. 2/2, 558916",84897669221
1310,Шубина Алина Эльдаровна,2010-09-12,Ж,"г. Кострома, пр. Крылова, д. 5 к. 485, 565314",89460528209
1311,Сафонов Герман Евсеевич,2011-03-26,М,"ст. Чусовой, пер. Заречный, д. 434, 219742",8 (503) 455-7646
1312,Ирина Вадимовна Тихонова,1972-12-13,Ж,"ст. Осташков, бул. Пархоменко, д. 22 к. 9, 374033",8 694 524 55 70
1313,Ульяна Ильинична Бирюкова,1980-02-17,Ж,"ст. Владимир, пр. Волкова, д. 8 к. 7, 631550",+7 903 240 3129
1314,Крылова Пелагея Эльдаровна,1996-06-06,Ж,"п. Забайкальск, алл. Дальневосточная, д. 1, 743097",8 395 414 53 40
1315,Валентина Степановна Фокина,2011-08-04,Ж,"д. Элиста, наб. Шмидта, д. 7 стр. 5/2, 268955",80992747024
1316,Кир Трофимович Яковлев,1979-01-19,М,"клх Игарка, пр. Пугачева, д. 5/1, 410243",83074667383
1317,Акулина Ильинична Зыкова,1980-12-06,Ж,"г. Каспийск, наб. Бабушкина, д. 7/4, 132687",82050858200
1318,тов. Савельева Лидия Тимуровна,1993-11-27,М,"клх Амурск, ул. Казачья, д. 9 к. 934, 953241",8 (126) 381-82-58
1319,Бобылев Кирилл Федосеевич,1981-04-22,М,"ст. Ведено, пер. Некрасова, д. 409 стр. 87, 844207",8 327 119 46 57
1320,Фокина Таисия Романовна,1996-03-02,Ж,"ст. Шенкурск, бул. Сенной, д. 528 стр. 741, 192377",8 (475) 982-3854
1321,Федотов Аверьян Эдгарович,2016-05-31,М,"ст. Владикавказ, ул. Специалистов, д. 718, 942245",+75610414300
1322,Жуков Аполлинарий Жанович,2012-12-07,М,"с. Ессентуки, алл. Краснофлотская, д. 418, 284201",83782413894
1323,Белов Дмитрий Игоревич,2019-11-27,М,"п. Слюдянка, алл. ДОС, д. 5, 431660",+7 098 779 4798
1324,Любосмысл Ануфриевич Туров,1986-03-03,М,"ст. Камышлов, бул. Проезжий, д. 371 к. 3/5, 867489",+7 (895) 245-2238
1325,Автоном Демидович Назаров,1975-09-09,М,"д. Яшкуль, бул. Красноармейский, д. 766 к. 8, 211585",+7 239 336 8676
1326,Пелагея Феликсовна Максимова,2023-05-21,Ж,"г. Макаров, бул. Баумана, д. 7, 831229",+7 306 575 3086
1327,Пономарев Ефим Иосипович,2023-05-24,М,"д. Мокшан, бул. Труда, д. 6/6, 565354",8 (999) 557-77-13
1328,Нонна Геннадиевна Наумова,2012-10-01,Ж,"г. Бреды, алл. Леонова, д. 679, 665166",+7 (290) 051-39-00
1329,Брагина Прасковья Андреевна,2000-08-07,Ж,"к. Пышма, ш. Станиславского, д. 3/8 стр. 715, 394248",87152027306
1330,Валентин Измаилович Горшков,1976-03-09,М,"г. Середниково, пер. Свердлова, д. 608 стр. 406, 831837",+7 003 870 0513
1331,Евсеев Мариан Вилорович,2015-07-10,М,"с. Анадырь, наб. Ленская, д. 497 к. 476, 751810",+7 718 721 58 25
1332,Рюрик Якубович Михеев,1979-02-19,М,"п. Курчатов, пр. Ударный, д. 516 стр. 82, 307793",8 750 697 8139
1333,Щукин Александр Викторович,2013-09-01,М,"к. Старый Оскол, пер. 60 лет СССР, д. 882 к. 735, 734494",+76191389027
1334,Прохоров Лука Иосифович,1978-12-13,М,"г. Кунгур, пер. Базарный, д. 5/2, 189118",+7 (316) 039-40-26
1335,Агата Рудольфовна Мясникова,2014-05-17,Ж,"п. Ведено, ш. Революции, д. 5, 498595",+7 206 808 77 97
1336,Вера Кузьминична Киселева,1970-06-22,Ж,"с. Санкт-Петербург, бул. Школьный, д. 22 стр. 7/3, 266661",8 (337) 842-2523
1337,Маргарита Артемовна Рогова,1984-12-28,Ж,"д. Зарайск, пр. Жуковского, д. 5 к. 57, 012227",8 112 719 66 84
1338,Горбунова Ирина Мироновна,1978-08-19,Ж,"с. Бологое, бул. Снежный, д. 8/5 стр. 824, 929328",8 502 051 36 65
1339,Радован Бенедиктович Уваров,2002-09-05,М,"к. Салават, алл. Аэродромная, д. 818 стр. 4/8, 523435",+7 (792) 086-5424
1340,Регина Павловна Константинова,2005-07-16,Ж,"г. Хасавюрт, ш. Гаражное, д. 1/5 к. 826, 442457",+7 327 679 6710
1341,Белякова Анастасия Георгиевна,1977-05-30,Ж,"д. Смирных, наб. Ленинградская, д. 39, 426289",+7 446 115 09 96
1342,Фаина Рубеновна Большакова,2013-06-18,Ж,"г. Уфа, пер. Мичурина, д. 95 к. 8/6, 109684",+7 (743) 928-83-57
1343,Стрелков Панкратий Феликсович,1996-05-21,М,"к. Смирных, пр. Сосновый, д. 3/7, 109146",8 568 420 42 66
1344,Шашкова Мария Тимофеевна,1999-05-11,Ж,"с. Змеиногорск, бул. Калинина, д. 3/8 к. 44, 368637",+7 (289) 115-62-39
1345,Лукия Александровна Логинова,2009-08-20,Ж,"ст. Черский, ул. Крылова, д. 2/6 к. 5/6, 207625",+7 (852) 422-35-55
1346,Волков Аркадий Венедиктович,1974-12-17,М,"с. Снежинск, бул. Сурикова, д. 44, 470294",8 497 962 9212
1347,Шестаков Степан Ильич,2016-10-16,М,"д. Дагомыс, ш. Невского, д. 521, 962898",+7 481 419 9787
1348,Соболев Иван Филатович,2022-03-26,М,"клх Гремячинск (Перм.), пр. Мусы Джалиля, д. 9, 146180",+7 (201) 654-5576
1349,Ираида Вадимовна Полякова,1993-08-29,Ж,"ст. Новочеркасск, пер. Степной, д. 9 к. 4, 678269",+7 772 434 36 05
1350,Владимирова Светлана Александровна,1990-05-31,Ж,"с. Лагань, наб. Индустриальная, д. 35, 306436",82101319101
1351,Назаров Данила Иосифович,1994-09-19,М,"к. Октябрьское (Челяб.), наб. Путейская, д. 9/1, 856716",8 (004) 607-94-81
1352,Агафон Владиславович Гусев,2004-10-18,М,"клх Асино, пр. Королева, д. 875, 926910",+7 154 712 2151
1353,г-н Лаврентьев Радислав Ильясович,1981-04-19,М,"клх Курган, алл. Каштановая, д. 1 к. 4, 970824",+7 055 721 84 30
1354,Сысоев Ладислав Борисович,2005-01-09,М,"д. Королев, ш. Мелиораторов, д. 132 к. 30, 183494",8 (067) 443-0731
1355,Стоян Васильевич Виноградов,1984-12-02,М,"п. Курчатов, ш. Главное, д. 6/2, 796154",8 176 809 1012
1356,Фёкла Святославовна Давыдова,1982-05-29,Ж,"д. Сеймчан, ул. Слободская, д. 6/4 к. 8/5, 436399",8 (490) 129-51-35
1357,Рожков Мир Ефимьевич,1989-09-07,М,"ст. Сосногорск, ш. Черноморское, д. 4 к. 948, 136738",8 599 122 1273
1358,Ермил Иосипович Смирнов,2021-06-14,М,"к. Кырен, ш. Геологическое, д. 4/5 к. 4/8, 636039",+7 612 606 55 61
1359,Буров Христофор Эдгардович,2006-12-26,М,"с. Невьянск, бул. Димитрова, д. 7/9 стр. 1, 101571",+7 521 470 13 53
1360,Ульян Чеславович Киселев,2001-10-22,М,"г. Енисейск, ш. Халтурина, д. 4/6, 418474",8 730 101 9323
1361,Морозова Фёкла Романовна,2013-09-16,Ж,"д. Краснотурьинск, ул. Степана Разина, д. 1 к. 9/8, 722982",+7 (915) 712-18-78
1362,Борис Брониславович Галкин,1977-09-15,М,"г. Карачаевск, пер. Жукова, д. 2, 826758",8 (255) 104-5143
1363,Лыткина Марфа Андреевна,1970-01-01,Ж,"п. Ярославль, наб. Рязанская, д. 792 стр. 363, 399261",+7 (268) 326-71-98
1364,Кудряшов Олимпий Игоревич,2007-06-07,М,"к. Терскол, ш. Центральное, д. 440 стр. 985, 191549",8 (277) 691-51-73
1365,Анастасия Богдановна Турова,2012-06-27,Ж,"д. Губкин, бул. Терешковой, д. 86, 178065",+7 083 289 20 77
1366,Лазарева Галина Владиславовна,1979-06-25,Ж,"клх Буйнакск, пер. Донской, д. 4, 909850",8 (145) 121-71-39
1367,Егор Феофанович Гришин,2021-01-21,М,"п. Пермь, бул. Урожайный, д. 8, 924009",85227529531
1368,Лыткин Самсон Ануфриевич,1973-05-24,М,"п. Пятигорск, алл. Профсоюзная, д. 1, 459907",+7 111 498 42 15
1369,Эмилия Ниловна Меркушева,2007-05-24,Ж,"к. Уссурийск, пр. Панфилова, д. 70 к. 131, 229993",+7 908 716 04 06
1370,Варвара Оскаровна Кузнецова,2019-03-07,Ж,"клх Звенигород, алл. Толстого, д. 58 стр. 73, 455032",+7 (404) 901-08-46
1371,Филиппова Ия Валериевна,1997-10-31,Ж,"г. Чебоксары, наб. Тукая, д. 9/1 к. 92, 762440",+7 792 730 96 13
1372,Большакова Клавдия Владиславовна,1983-07-03,Ж,"с. Крымск, наб. Сплавная, д. 7 к. 526, 416532",+7 073 194 79 65
1373,Шарапов Прокл Ефремович,1974-10-04,М,"г. Дивногорск, алл. Водников, д. 9 стр. 3, 602771",+7 (818) 955-92-40
1374,Шарапова Клавдия Аркадьевна,2014-01-21,Ж,"клх Котельнич, алл. Суворова, д. 571 к. 2, 805924",+7 818 269 7148
1375,Исидор Фадеевич Антонов,2007-12-22,М,"к. Горячинск, пр. Широкий, д. 53, 095819",+7 (849) 514-71-33
1376,Маргарита Эльдаровна Третьякова,1992-03-21,Ж,"клх Бугульма, бул. Заречный, д. 7/2, 657354",8 913 310 9256
1377,Анисимов Родион Евсеевич,2014-10-20,М,"ст. Черкесск, наб. Озерная, д. 9 стр. 8/7, 255362",+7 788 775 66 68
1378,Фёкла Юрьевна Сазонова,2009-07-26,Ж,"п. Зеленоград, пр. Сосновый, д. 92, 631551",81852233446
1379,Воронцова Евгения Аркадьевна,2015-07-02,Ж,"п. Сальск, ул. Московская, д. 8/1, 756513",+7 800 930 3742
1380,Кира Никифоровна Фролова,1993-09-19,Ж,"д. Лысьва, бул. Трактовый, д. 3, 234533",8 (354) 178-2066
1381,Щербаков Карл Измаилович,1985-02-03,М,"ст. Печора, наб. 50 лет Победы, д. 6/3, 248371",8 (764) 867-6752
1382,Блинов Лазарь Ефимьевич,1986-11-07,М,"клх Карталы, бул. 70 лет Октября, д. 779 стр. 62, 491980",+7 469 630 4534
1383,Елизавета Эльдаровна Горшкова,2015-08-12,Ж,"с. Юрюзань, пер. Дальневосточный, д. 464 стр. 776, 005312",+7 933 439 5029
1384,Никитина Ольга Семеновна,1986-08-31,Ж,"п. Тарко-Сале, наб. Амурская, д. 7/4 стр. 994, 035510",8 612 977 21 07
1385,Кулагина Маргарита Аркадьевна,1999-01-30,Ж,"г. Шенкурск, ш. Щорса, д. 67 стр. 3, 347678",+7 258 691 92 11
1386,Вероника Антоновна Бобылева,1984-04-24,Ж,"г. Мичуринск, ш. Литейное, д. 6, 679547",+7 211 127 84 07
1387,Фортунат Авдеевич Моисеев,1993-11-20,М,"к. Палана, пр. Циолковского, д. 987 стр. 54, 552072",+76012701695
1388,Всеслав Евстигнеевич Чернов,1993-02-11,М,"к. Горно-Алтайск, пр. Дарвина, д. 7/8, 053826",+7 (092) 693-4782
1389,Тамара Альбертовна Сафонова,2014-05-19,Ж,"к. Калининград, пр. Победа, д. 2, 651441",+7 042 216 53 17
1390,Рюрик Иосипович Потапов,2001-06-03,М,"к. Адыгейск, бул. 40 лет Октября, д. 4 стр. 5, 102017",+7 112 487 6812
1391,Лазарева Регина Станиславовна,1979-05-19,Ж,"г. Канск, ш. Матросова, д. 282 стр. 7/4, 456715",+7 022 805 6369
1392,Соболева Светлана Антоновна,2001-07-04,Ж,"п. Кинешма, ул. Красноярская, д. 1/9, 500867",+7 (869) 650-30-34
1393,Ипатий Демидович Горбачев,1987-06-20,М,"ст. Шали, пр. Щорса, д. 6/2 стр. 92, 709712",+7 (377) 037-0816
1394,Миронов Феофан Витальевич,2016-01-07,М,"ст. Павловская, ш. Привокзальное, д. 5/2 стр. 2, 187364",8 (932) 469-0762
1395,Лев Ярославович Щербаков,2000-05-14,М,"с. Энгельс, ул. Красноармейская, д. 7 к. 349, 976105",8 914 918 7367
1396,Голубева Вероника Анатольевна,1998-04-13,Ж,"к. Петушки, пр. Озерный, д. 4/5, 466696",+7 566 492 6020
1397,Василий Федосеевич Романов,1995-09-09,М,"г. Киров (Вятка), пер. Мелиоративный, д. 458 стр. 20, 277033",8 081 458 2669
1398,Жданова Ульяна Ниловна,2007-11-01,Ж,"с. Котлас, ш. Горное, д. 993 к. 20, 518994",+7 (371) 401-7061
1399,Елена Федоровна Макарова,2010-10-11,Ж,"к. Устюжна, ш. Брянское, д. 60 стр. 933, 357013",84858129332
1400,Онуфрий Аверьянович Воробьев,1975-11-17,М,"клх Краснотурьинск, ш. Шахтерское, д. 7, 168121",+7 042 719 90 13
1401,Бирюков Рюрик Трофимович,1998-10-09,М,"д. Ачхой Мартан, наб. Вольная, д. 99 стр. 559, 511982",8 732 960 66 67
1402,Ильин Устин Витальевич,1977-08-29,М,"к. Бугуруслан, алл. Звездная, д. 7, 464115",+72751224365
1403,Аникей Адамович Титов,1999-12-22,М,"д. Павловский Посад, алл. Ветеранов, д. 52, 042542",8 548 143 8090
1404,Фёкла Петровна Романова,2000-02-15,Ж,"клх Алапаевск, пер. Республиканский, д. 2/6 стр. 6, 329146",8 (541) 436-4769
1405,Фаина Богдановна Воробьева,1977-10-18,Ж,"п. Калининград, наб. Кедровая, д. 605 стр. 910, 832035",8 (741) 938-2682
1406,Изот Витальевич Баранов,2017-07-17,М,"п. Гдов, пер. Шмидта, д. 224, 625515",8 (827) 803-70-16
1407,Борисова Пелагея Геннадиевна,1996-03-30,Ж,"г. Ногинск (Моск.), пр. Октября, д. 1/6 стр. 5/1, 415942",8 768 016 80 16
1408,Королев Виталий Гавриилович,1996-06-02,М,"ст. Горячинск, ш. Дальневосточное, д. 3/3, 840370",+7 (343) 397-9453
1409,Гущина Майя Валентиновна,1999-04-08,Ж,"ст. Суздаль, пр. Краснофлотский, д. 598 стр. 3, 878804",8 (064) 369-1477
1410,Маргарита Игоревна Молчанова,2017-08-10,Ж,"к. Великие Луки, алл. Стадионная, д. 5 стр. 96, 130420",8 263 354 4419
1411,Флорентин Данилович Новиков,1972-05-04,М,"п. Ведено, ул. Солнечная, д. 7/1 к. 2/8, 695049",8 184 161 3655
1412,Гордеев Афанасий Ермилович,1979-10-02,М,"с. Чегем, ш. Поселковое, д. 6/4, 735722",+74419758474
1413,г-жа Козлова Агафья Рубеновна,1996-03-20,Ж,"ст. Тамбей, наб. Стадионная, д. 10 стр. 8/5, 166226",+7 (129) 584-6693
1414,Крылова Виктория Олеговна,2020-05-23,Ж,"г. Ряжск, наб. Молодежная, д. 53 стр. 6, 285736",84093463522
1415,Федотов Елизар Валерьянович,2020-02-18,М,"ст. Приозерск, наб. Болотная, д. 48 к. 76, 696196",+7 (651) 121-0356
1416,Беспалова Ираида Афанасьевна,2018-06-24,Ж,"г. Темрюк, пр. Первомайский, д. 894 стр. 331, 829778",82067337035
1417,Дарья Кирилловна Орехова,2016-12-09,Ж,"ст. Октябрьское (Хант.), пр. Горный, д. 277 к. 7/4, 989576",8 (616) 818-8507
1418,Григорьев Наум Харлампьевич,1986-09-20,М,"к. Луга, наб. Болотная, д. 16 к. 73, 011641",8 613 351 7202
1419,Евдокимов Капитон Федотович,1972-07-28,М,"г. Игнашино, бул. Подстанция, д. 1 стр. 7/4, 314545",+7 426 981 4040
1420,Костин Натан Анатольевич,2003-10-28,М,"к. Черемхово, пер. Ручейный, д. 81 к. 21, 292756",+7 576 685 2027
1421,Виктория Афанасьевна Лыткина,1977-04-09,Ж,"с. Чайковский, бул. Лазо, д. 3/2 стр. 9/4, 038858",+7 403 410 96 55
1422,Смирнова Анжелика Афанасьевна,1978-03-29,Ж,"к. Палана, пр. Тукая, д. 9/6, 584936",8 (104) 573-4160
1423,Зыкова Ксения Константиновна,2016-05-29,Ж,"клх Балашиха, пр. Мусы Джалиля, д. 7/9, 356034",8 253 069 0840
1424,Регина Кирилловна Костина,2016-09-24,Ж,"с. Петушки, ул. Рыбацкая, д. 1/5 к. 51, 083965",8 026 262 67 92
1425,Фокина Алла Ильинична,1982-07-29,Ж,"к. Сальск, пер. Аэродромный, д. 2/8 к. 704, 728584",+7 370 642 4854
1426,Дмитриев Демьян Бенедиктович,1987-06-21,М,"г. Вытегра, ш. Амурское, д. 832, 382100",+7 562 130 40 11
1427,Ангелина Максимовна Шубина,2013-07-25,Ж,"г. Стрежевой, ул. Дальневосточная, д. 138 стр. 522, 091984",+7 006 397 1811
1428,Носков Леонтий Эдгарович,2008-09-06,М,"д. Петушки, ш. Беляева, д. 8, 060175",+7 (159) 021-02-72
1429,Евпраксия Борисовна Миронова,2020-04-29,Ж,"ст. Октябрьское (Хант.), пер. Вокзальный, д. 4 к. 8/3, 121626",+7 (808) 086-0753
1430,Мариан Алексеевич Ермаков,1981-05-19,М,"клх Ербогачен, пер. Октябрьский, д. 5/3 стр. 29, 559407",83601222148
1431,Родионов Лаврентий Харламович,1979-05-02,М,"д. Ярославль, наб. Крымская, д. 2/2, 780076",+74679540570
1432,Иванна Кузьминична Зыкова,2008-08-27,Ж,"клх Терней, алл. Енисейская, д. 1 стр. 1, 143931",+7 291 963 00 51
1433,Мария Дмитриевна Белоусова,2011-01-02,Ж,"г. Северодвинск, пр. Харьковский, д. 43 к. 376, 267126",8 391 130 93 18
1434,Эмилия Михайловна Ларионова,2002-12-07,Ж,"п. Якша, ул. Новая, д. 2/7, 830144",+7 (841) 201-18-08
1435,Кулагина Валентина Никифоровна,2007-05-15,Ж,"ст. Ясный (Оренб.), ул. Кузнецова, д. 36 стр. 846, 788662",8 843 712 78 36
1436,Павлов Евграф Фомич,1991-01-31,М,"п. Кашхатау, наб. Щербакова, д. 516 к. 9/1, 752869",82579505455
1437,Васильева Прасковья Геннадиевна,1981-08-20,Ж,"клх Кош-Агач, бул. 8-е Марта, д. 7/7, 770867",+7 530 279 40 03
1438,тов. Анисимова Раиса Валериевна,1996-08-03,М,"г. Хужир, алл. Юности, д. 2/9, 663944",+7 073 128 9214
1439,Иванна Феликсовна Шилова,1989-07-09,Ж,"к. Майкоп, алл. Физкультурная, д. 8 к. 4, 699178",8 (795) 076-20-74
1440,Никифор Еремеевич Ершов,1985-09-01,М,"г. Диксон, наб. Войкова, д. 32, 573311",8 (284) 180-1624
1441,Светлана Юльевна Исакова,1988-02-20,Ж,"п. Североморск, бул. Волжский, д. 1/5 к. 6, 570837",8 (956) 802-7794
1442,Сидор Ефимьевич Зыков,1998-04-13,М,"д. Можайск, пер. Березовый, д. 52 к. 347, 319005",+7 536 232 63 07
1443,София Леонидовна Блохина,2007-06-09,Ж,"д. Шадринск, ул. Просторная, д. 87, 671576",+7 (782) 167-04-85
1444,Брагин Ким Дмитриевич,1994-05-04,М,"п. Оха, алл. Автомобилистов, д. 1/9 стр. 4, 361781",+7 216 693 7325
1445,Носкова Анжела Евгеньевна,2005-12-31,Ж,"п. Уварово, пер. Кошевого, д. 5, 718596",8 785 868 51 62
1446,Шарапов Карп Алексеевич,2018-11-17,М,"к. Саранск, ул. Сельская, д. 475, 315763",8 117 712 4510
1447,Третьяков Лазарь Игнатович,2000-05-05,М,"клх Дивногорск, бул. Портовый, д. 33 к. 7, 199198",+7 005 906 33 73
1448,Марфа Аркадьевна Попова,1993-03-01,Ж,"клх Верхний Баскунчак, пер. Загородный, д. 6/1 к. 66, 062480",8 (107) 171-35-31
1449,Ильин Артем Эдгарович,1987-08-03,М,"г. Курчатов, ш. Коммунаров, д. 1/8 к. 864, 985576",8 (348) 606-91-89
1450,Павел Еремеевич Чернов,2008-08-16,М,"клх Южно-Сахалинск, пер. Серова, д. 54 стр. 372, 297338",+7 175 513 39 85
1451,Юлия Викторовна Медведева,2001-04-10,Ж,"п. Черемхово, наб. Лазурная, д. 9 к. 6/8, 953488",+7 (096) 705-44-77
1452,Тимур Алексеевич Муравьев,1982-07-14,М,"с. Яхрома, ш. Мая 1, д. 579 стр. 904, 246824",+77346926007
1453,Кондратий Давидович Герасимов,2021-12-04,М,"п. Златоуст, пр. Локомотивный, д. 784, 708571",+7 (543) 166-2081
1454,Лора Вениаминовна Моисеева,1992-03-09,Ж,"д. Псков, ш. Ленина, д. 18, 530479",+7 (243) 280-08-32
1455,Натан Тимурович Васильев,1975-09-03,М,"д. Красноселькуп, бул. Ягодный, д. 8, 468571",+7 417 764 3098
1456,Любим Ааронович Рябов,1978-01-17,М,"к. Дзержинск, ш. Базарное, д. 1/6, 495848",8 082 681 7083
1457,Игнатова Жанна Ивановна,2010-10-19,Ж,"п. Южноуральск, наб. Ленская, д. 7/9 стр. 16, 770759",+74915112927
1458,Ситников Евграф Феофанович,2000-10-01,М,"клх Мелеуз, пер. Тюленина, д. 55 к. 8/6, 630104",8 488 717 0536
