3710,Никифор Власович Игнатьев,1970-02-13,М,"п. Верхнее Пенжино, ул. Геологов, д. 2, 289784",+7 518 678 2489
3711,тов. Яковлев Давыд Феоктистович,2004-10-28,М,"п. Чебаркуль, пр. Союзный, д. 4/6 стр. 1, 193640",82764297328
3712,Валерия Оскаровна Субботина,1977-03-27,Ж,"к. Каспийск, пер. Надежды, д. 4/5 стр. 639, 630607",+7 (307) 094-99-22
3713,Евдокимов Артемий Арсенович,1984-09-18,М,"с. Шатой, пр. Буденного, д. 212 стр. 7, 536701",+7 (630) 139-0846
3714,Воронцов Аверьян Аксёнович,2013-12-02,М,"к. Анадырь, ул. Республиканская, д. 337 к. 67, 437056",+7 (790) 640-98-87
3715,Авксентий Арсенович Быков,2008-01-14,М,"п. Кижи, ул. Ленинская, д. 64 к. 4/4, 284652",+77957294223
3716,Дементьев Остромир Демидович,1981-02-09,М,"п. Алдан, пер. Транспортный, д. 3, 872047",+7 231 718 5061
3717,Потапова Ангелина Рудольфовна,2018-01-24,Ж,"ст. Диксон, пр. Ленина, д. 96 стр. 3, 268955",+7 (077) 927-1140
3718,Корнилова Синклитикия Альбертовна,2013-05-03,Ж,"клх Канск, ул. Донская, д. 3/7 стр. 17, 363230",8 (148) 809-9823
3719,Нина Матвеевна Кудрявцева,1990-06-22,Ж,"к. Южно-Сахалинск, пр. Громова, д. 6, 651521",8 (356) 997-0220
3720,Григорий Бориславович Ершов,1976-11-06,М,"д. Армавир, ш. Морозова, д. 324, 775423",8 (526) 192-9257
3721,Конон Дорофеевич Игнатов,1972-08-09,М,"д. Мирный, пер. Выгонный, д. 999, 499694",8 441 986 8826
3722,Колобов Артемий Матвеевич,2007-12-20,М,"ст. Кижи, пер. Вокзальный, д. 4, 391839",8 (390) 027-32-20
3723,Щербакова София Львовна,2015-02-07,Ж,"ст. Новокузнецк, пр. Запрудный, д. 771, 939375",+7 800 020 2316
3724,Алексей Фролович Кошелев,2009-04-30,М,"д. Борзя, ш. Беляева, д. 7/8, 250000",8 (249) 459-59-66
3725,Синклитикия Владиславовна Наумова,1984-05-11,Ж,"п. Невьянск, алл. Островского, д. 3, 005677",+7 998 979 72 20
3726,Антонина Кирилловна Антонова,2018-04-05,Ж,"д. Усть-Кут, пер. Союзный, д. 6 к. 8/2, 261680",+7 (080) 569-27-07
3727,Евстигней Харламович Крюков,2022-07-29,М,"с. Вязьма, бул. Пограничный, д. 196 стр. 3, 834676",+7 009 369 6234
3728,Антонина Геннадьевна Мишина,1987-04-11,Ж,"клх Оренбург, бул. Ангарский, д. 57 к. 1/3, 500115",+7 340 581 88 51
3729,Воробьев Милен Евстигнеевич,2011-02-12,М,"к. Нефедова, пер. Базарный, д. 5 к. 24, 605470",8 (856) 777-02-12
3730,Мухина Алла Филипповна,2014-12-21,Ж,"ст. Красноуфимск, пр. Буденного, д. 3/6, 224071",+7 652 139 3887
3731,Зимина Евдокия Владиславовна,1977-09-13,Ж,"ст. Гремячинск (Перм.), наб. Коминтерна, д. 25 стр. 929, 201884",8 568 729 00 71
3732,Иванна Филипповна Ширяева,1979-04-02,Ж,"г. Ельня, ш. Луначарского, д. 250 к. 1, 193918",+7 595 252 79 12
3733,Иван Фролович Стрелков,1996-09-01,М,"ст. Адлер, алл. Ручейная, д. 551, 359813",8 332 912 71 29
3734,Никодим Власович Капустин,1974-12-06,М,"д. Эльтон, пер. Февральский, д. 5/4 к. 717, 743250",81232780324
3735,Любовь Оскаровна Филатова,1983-06-12,М,"клх Абакан, ул. Владимирская, д. 59 к. 8, 829890",8 708 316 25 92
3736,Марфа Юрьевна Кабанова,1982-08-31,Ж,"клх Ноябрьск, пр. Гражданский, д. 17 стр. 5/4, 435253",+7 (923) 206-5632
3737,Нинель Матвеевна Ершова,2004-02-25,М,"п. Сосногорск, пр. Щетинкина, д. 84 к. 243, 005818",8 853 041 65 84
3738,Лыткин Нифонт Анатольевич,2013-11-13,М,"д. Смирных, ш. Челюскинцев, д. 63, 686965",+7 (318) 769-91-45
3739,Лидия Львовна Захарова,1972-12-23,Ж,"д. Новгород Великий, бул. Первомайский, д. 8/5 к. 7, 828269",+7 588 617 11 76
3740,Изот Афанасьевич Молчанов,2004-03-13,М,"г. Александров Гай, пр. Островского, д. 43 к. 735, 645705",8 329 960 51 98
3741,Исидор Тимурович Комаров,1984-02-03,М,"клх Грозный, ул. Чапаева, д. 1/2 к. 911, 990537",8 674 308 0937
3742,Белозеров Иван Арсенович,1972-06-01,М,"ст. Ирбит, алл. Кубанская, д. 2/6, 914732",+79442898408
3743,Вячеслав Жанович Киселев,1986-09-03,М,"клх Ульяновск, ул. Инженерная, д. 1 стр. 8, 200831",+7 (155) 204-4574
3744,Горбачева Кира Федоровна,1990-08-05,Ж,"г. Диксон, ул. Литейная, д. 2 к. 272, 655177",+7 (942) 284-10-45
3745,Полякова Виктория Робертовна,1974-04-18,Ж,"с. Тырныауз, пер. Уральский, д. 262 к. 22, 960277",8 234 111 28 40
3746,Анна Вениаминовна Сидорова,2004-09-16,Ж,"г. Вытегра, бул. Беляева, д. 1/1 стр. 75, 105669",+7 433 334 29 63
3747,Фирс Ануфриевич Ларионов,2002-07-02,М,"г. Ербогачен, пр. Угольный, д. 5/6 к. 7/5, 634808",88425042622
3748,Громов Сигизмунд Витальевич,1993-05-14,М,"д. Воркута, пр. Песчаный, д. 91 к. 795, 486716",8 (352) 473-99-20
3749,Еремей Ефстафьевич Дорофеев,1977-02-27,М,"к. Томари, пр. Красногвардейский, д. 856 стр. 619, 523363",+7 705 973 3794
3750,Никифорова Надежда Кузьминична,1980-11-11,Ж,"ст. Рязань, ул. Депутатская, д. 78 к. 9/3, 321747",+7 (121) 665-62-37
3751,Ермакова Алевтина Рубеновна,2016-02-18,Ж,"д. Верхнее Пенжино, алл. Володарского, д. 1 стр. 569, 181544",+78809744697
3752,Мария Матвеевна Бобылева,2020-07-31,Ж,"п. Арзамас, бул. Павлика Морозова, д. 6/2 стр. 14, 826101",8 (380) 692-2434
3753,Баранов Кирилл Жанович,2023-09-15,М,"к. Гдов, ул. Дружба, д. 9/7 стр. 204, 720899",+71436698011
3754,Якушев Ефим Абрамович,1971-05-04,М,"клх Александров, наб. Высоковольтная, д. 3 стр. 8/5, 244137",82680005510
3755,Федотова Надежда Леонидовна,1981-04-12,Ж,"к. Щелково, пер. Халтурина, д. 802 к. 169, 110246",8 309 499 31 98
3756,Ананий Валерианович Богданов,2023-08-26,М,"с. Киржач, бул. Чехова, д. 35 к. 11, 286235",8 947 821 7539
3757,Эмилия Валериевна Некрасова,2004-02-28,Ж,"ст. Рыльск, бул. Мира, д. 805 стр. 58, 301366",8 (172) 643-0421
3758,Нонна Григорьевна Лазарева,1978-04-01,Ж,"к. Набережные Челны, алл. Производственная, д. 200 к. 373, 650834",8 (364) 444-69-72
3759,тов. Белякова Зинаида Федоровна,2002-07-02,М,"клх Жигулевск, бул. Горный, д. 1, 002316",8 (499) 370-3795
3760,Лебедева Фаина Никифоровна,1992-03-31,Ж,"п. Сузун, пер. Песочный, д. 4/1 стр. 7/2, 532609",8 061 761 94 55
3761,тов. Гущин Герасим Викентьевич,1987-11-02,М,"к. Старая Русса, пр. Кутузова, д. 249 стр. 192, 405990",8 (525) 402-81-76
3762,Кондрат Анисимович Попов,1983-02-23,М,"клх Магас, пр. Павлика Морозова, д. 4, 385719",80793963167
3763,Дроздов Иннокентий Фадеевич,1970-09-19,М,"г. Южно-Сахалинск, ш. Энтузиастов, д. 6, 810383",+7 (788) 255-8741
3764,Вячеслав Фролович Трофимов,1973-06-14,М,"с. Барнаул, пер. Тополиный, д. 2 стр. 769, 715089",88167706887
3765,Эмилия Леонидовна Бурова,1981-05-20,Ж,"клх Асбест, ш. Трактовое, д. 64 к. 14, 887746",8 384 573 60 81
3766,Кудряшова Марина Петровна,2010-03-06,Ж,"ст. Мончегорск, ш. Фадеева, д. 74 стр. 41, 652495",+7 109 079 3422
3767,Новиков Адриан Гавриилович,1986-12-18,М,"клх Павловская, ул. Раздольная, д. 919 стр. 244, 359843",+7 937 678 4904
3768,Ростислав Ануфриевич Лаврентьев,2019-06-26,М,"клх Хужир, пр. Бабушкина, д. 23 к. 6, 976604",8 (589) 875-9549
3769,Шилов Вацлав Адамович,2004-03-06,М,"клх Кировск (Мурм.), пр. Пугачева, д. 37 стр. 6/8, 820250",+79796371946
3770,Тимур Бориславович Евдокимов,1981-05-30,М,"п. Каменномостский, пр. Коллективный, д. 24 к. 632, 783962",+77181683180
3771,Панфилов Влас Аксёнович,2003-08-13,М,"д. Каневская, бул. Дружбы, д. 9/7, 617369",8 (481) 729-9730
3772,Фомина Ангелина Мироновна,2021-05-08,Ж,"п. Вологда, алл. М.Горького, д. 166, 559004",8 587 187 95 99
3773,Аггей Ефстафьевич Осипов,1999-10-25,М,"п. Уссурийск, ш. Пугачева, д. 5/1, 658440",+7 (717) 371-7491
3774,Евпраксия Григорьевна Александрова,1972-05-01,Ж,"с. Яшалта, ш. Российское, д. 608, 788285",+7 033 840 3548
3775,Агата Максимовна Тимофеева,1987-01-27,Ж,"клх Оймякон, алл. Абрикосовая, д. 6, 980106",+75554779438
3776,Селиверст Елизарович Пахомов,2010-07-12,М,"г. Орехово-Зуево, алл. Трактовая, д. 4/8 к. 2, 739218",+7 480 435 0542
3777,Артем Елизарович Вишняков,2015-06-09,М,"к. Губкин, пр. Медицинский, д. 41 стр. 4, 001598",+7 745 479 61 95
3778,Бирюков Трофим Яковлевич,1982-03-14,М,"к. Бологое, алл. Пограничная, д. 8/8 стр. 18, 306856",8 825 738 1471
3779,Селезнева Зинаида Тимуровна,2014-09-08,Ж,"г. Сорочинск, пр. Светлый, д. 67 стр. 1, 003485",8 954 647 97 79
3780,Зайцева Зоя Юльевна,1987-02-02,Ж,"д. Златоуст, наб. Юности, д. 577, 524900",+7 (008) 788-26-74
3781,Якуб Геннадиевич Щукин,1976-10-27,М,"с. Чебаркуль, бул. Королева, д. 6 стр. 47, 250061",8 (722) 375-66-03
3782,Эмиль Вилорович Федотов,2012-05-12,М,"ст. Катав-Ивановск, пер. Дальний, д. 690, 511358",8 (019) 178-50-39
3783,Валерия Юльевна Журавлева,1996-05-06,Ж,"ст. Мытищи, алл. Ясная, д. 576 стр. 2/8, 493766",8 (913) 450-13-03
3784,Кондрат Захарьевич Дементьев,1987-07-13,М,"ст. Краснотурьинск, бул. Коллективный, д. 550 к. 4/6, 375601",8 (406) 948-89-49
3785,Евпраксия Алексеевна Гордеева,2001-05-09,Ж,"с. Оленегорск (Якут.), ш. Ушакова, д. 3/1, 057545",+7 (806) 211-7513
3786,Алина Натановна Дьячкова,1997-09-10,Ж,"ст. Палана, ул. Рябиновая, д. 3 к. 6/6, 938117",+7 (503) 578-24-77
3787,Селиверстов Назар Вилорович,2018-09-01,М,"п. Салехард, алл. Кирпичная, д. 68, 870142",+7 (578) 825-9311
3788,Никонов Прокл Феодосьевич,2012-05-26,М,"г. Обоянь, бул. Журавлева, д. 604 к. 55, 528339",+7 (491) 907-03-02
3789,Зоя Валериевна Карпова,1990-09-10,Ж,"клх Макушино, пр. Курчатова, д. 43 к. 553, 048884",+79689839195
3790,Остап Дмитриевич Зуев,1996-12-14,М,"клх Тверь, ш. Рязанское, д. 2/2 стр. 1/4, 406214",+7 264 138 0026
3791,Савельев Венедикт Филатович,1970-10-12,М,"д. Малгобек, бул. Коммунистический, д. 31 к. 533, 512911",8 666 910 45 50
3792,Александров Радим Виленович,1976-01-17,М,"клх Туапсе, ш. Вахитова, д. 3 к. 657, 583089",8 (729) 560-1669
3793,Варлаам Богданович Кириллов,1977-11-12,М,"с. Каргополь, бул. 50 лет Победы, д. 453 к. 208, 645221",+7 173 545 1155
3794,Зыкова Милица Викторовна,2007-07-21,Ж,"п. Верхнее Пенжино, ш. Аэродромное, д. 8/3 к. 709, 919275",8 (789) 332-1991
3795,Щербаков Ладислав Анатольевич,1998-12-24,М,"ст. Внуково (метеост.), наб. Воронежская, д. 628 к. 5, 231318",8 709 669 0798
3796,Вениамин Тарасович Лазарев,2007-03-28,М,"г. Александровск, алл. Угловая, д. 3/2 стр. 309, 504217",+7 (975) 550-99-82
3797,Уваров Елизар Трофимович,1980-09-26,М,"ст. Ясный (Оренб.), ш. Привокзальное, д. 963 стр. 9/4, 317268",+7 (433) 430-04-12
3798,Горбунова Раиса Филипповна,1998-03-30,Ж,"клх Мценск, ш. Лесозаводское, д. 640, 160098",8 (362) 301-04-12
3799,Медведев Роман Даниилович,1972-02-17,М,"п. Черняховск, пер. Осипенко, д. 7 стр. 99, 820450",+7 (475) 832-71-76
3800,Агап Якубович Панов,1977-04-07,М,"к. Куртамыш, ул. Кооперативная, д. 97 к. 54, 087626",80777337826
3801,Галина Вениаминовна Рогова,1977-12-13,Ж,"к. Муром, алл. Ватутина, д. 9 к. 90, 539466",+75227302385
3802,Антонина Харитоновна Некрасова,1999-07-06,Ж,"к. Устюжна, алл. Прудная, д. 73 стр. 9/4, 070751",8 975 648 64 95
3803,Мстислав Марсович Игнатьев,1992-08-07,М,"п. Североуральск, наб. Геологическая, д. 2 к. 1/2, 389655",89953722472
3804,Назаров Святослав Григорьевич,1970-03-16,М,"г. Троицк (Челяб.), наб. Кошевого, д. 7, 253320",8 574 864 68 62
3805,Жанна Степановна Фомина,1989-06-10,Ж,"п. Егорьевск, ул. Химиков, д. 9/7, 780264",+70607594347
3806,Вацлав Абрамович Трофимов,1998-03-27,М,"клх Чебаркуль, ул. Дальняя, д. 27 к. 86, 560768",85648413756
3807,Ювеналий Демьянович Фомичев,1980-03-10,М,"г. Рубцовск, бул. Рябиновый, д. 3/4, 885847",+7 131 003 51 00
3808,Чернов Потап Бориславович,2014-03-07,М,"ст. Златоуст, наб. Мирная, д. 8 стр. 8, 791249",8 729 596 66 10
3809,Воронова Евпраксия Валериевна,1988-01-02,Ж,"д. Ноглики, пр. Прудовой, д. 77 стр. 3, 025467",8 (278) 146-77-74
3810,Евгения Харитоновна Лаврентьева,2018-10-18,Ж,"ст. Якша, бул. Юбилейный, д. 8 стр. 6/4, 378942",+7 933 986 46 55
3811,Феоктист Валерьянович Лобанов,2010-02-22,М,"с. Льгов, наб. Дзержинского, д. 2/9, 416397",8 (068) 111-1620
3812,г-н Фомин Егор Евсеевич,2022-12-05,М,"п. Шатки, ул. Волжская, д. 9/4 к. 85, 110661",+7 051 196 4259
3813,Людмила Мироновна Морозова,1988-07-09,Ж,"с. Завьялиха, пер. Толстого, д. 82, 143560",8 333 799 17 31
3814,Евсеева Нонна Эдуардовна,2009-10-06,Ж,"п. Ростов, пер. Новоселов, д. 18 к. 1/3, 305372",8 031 372 50 63
3815,Зайцев Аполлинарий Феликсович,1996-11-15,М,"г. Камышин, наб. Ясная, д. 10, 187220",+7 851 103 6628
3816,Поликарп Денисович Анисимов,1976-06-24,М,"к. Новороссийск, ул. Глинки, д. 952 стр. 183, 168382",8 (169) 114-15-38
3817,Медведева Вероника Валентиновна,1997-04-20,Ж,"г. Юрьев-Польский, пер. Первомайский, д. 1 стр. 568, 081884",8 386 299 5657
3818,Бурова Тамара Болеславовна,2009-10-30,Ж,"к. Новая Игирма, пер. Кузнечный, д. 7/1, 673087",86432016763
3819,Кондратий Иосифович Мельников,1984-09-08,М,"клх Петухово, ш. Новое, д. 6, 649642",89390565798
3820,Элеонора Филипповна Якушева,1998-09-13,Ж,"клх Рыбинск, пер. Макаренко, д. 2/2 к. 4, 936495",+7 888 410 5759
3821,Фома Игнатович Терентьев,2002-02-28,Ж,"ст. Горно-Алтайск, ш. Ягодное, д. 7, 447714",8 (745) 240-59-64
3822,Сократ Богданович Беляев,1980-06-07,М,"г. Снежногорск (Мурм.), алл. Карла Маркса, д. 84 стр. 71, 238449",+7 828 315 90 29
3823,Валерия Филипповна Комарова,1989-03-03,Ж,"д. Сасово, бул. Рыбацкий, д. 7/2, 924490",+7 (459) 612-5461
3824,Измаил Харламович Моисеев,1988-09-07,М,"п. Каменск-Шахтинский, алл. Цветочная, д. 68 к. 6/3, 157155",+7 (489) 004-6491
3825,Васильева Эмилия Вениаминовна,1993-04-07,Ж,"г. Нарьян-Мар, наб. Пригородная, д. 32, 735209",+7 (718) 087-90-18
3826,Прасковья Вадимовна Исаева,2002-04-20,Ж,"ст. Александровск-Сахалинский, алл. Никитина, д. 9/8 стр. 652, 584275",+7 (768) 800-66-24
3827,Митофан Филатович Фокин,1975-01-11,М,"клх Саров (Морд.), пр. Макарова, д. 961 к. 8, 567988",+7 520 738 22 73
3828,Дьячкова Прасковья Антоновна,1971-12-31,Ж,"клх Туапсе, ул. Ломоносова, д. 430 стр. 847, 677015",8 (897) 262-0984
3829,Агафонов Ратибор Демидович,1990-04-24,М,"д. Богучар, ул. Курортная, д. 7 стр. 8, 088914",+7 (182) 637-2807
3830,Фролов Всеволод Фролович,2018-07-28,М,"к. Псков, пер. Космодемьянской, д. 2/1, 024571",+7 (521) 779-4934
3831,Жданова Раиса Феликсовна,1973-07-06,Ж,"д. Брянск, бул. Депутатский, д. 6, 305967",+7 160 597 9182
3832,Муравьева Екатерина Захаровна,1970-03-20,Ж,"ст. Тырныауз, пер. Ольховый, д. 120 к. 721, 814569",8 483 357 6862
3833,Герасим Эдгарович Никонов,1988-10-14,М,"г. Кропоткин (Краснод.), алл. Байкальская, д. 97, 980111",+7 928 080 7341
3834,Панфилов Селиверст Эдгарович,2009-12-09,М,"с. Оймякон, пр. Мая 1, д. 8/1, 289981",+76339632008
3835,Панкратий Афанасьевич Андреев,1971-11-04,М,"ст. Лысьва, ш. Угольное, д. 2/2 к. 4/8, 610386",+74042313234
3836,Агафон Евсеевич Пестов,2018-10-14,М,"к. Владивосток, ул. Воронежская, д. 3 стр. 208, 570020",8 764 603 61 26
3837,Любовь Львовна Никитина,1998-10-11,М,"п. Москва, МГУ, наб. Индустриальная, д. 4, 254525",+7 214 071 3459
3838,Мухина Ия Григорьевна,1980-08-06,Ж,"п. Юровск, наб. Аэродромная, д. 1 к. 9, 381323",8 574 356 58 66
3839,Борисов Софон Терентьевич,1970-04-05,М,"к. Боровск, наб. Морская, д. 7/2 к. 2, 552366",8 (724) 725-90-19
3840,Егор Вилорович Савельев,1974-11-21,М,"ст. Надым, пер. Геологический, д. 10 стр. 62, 505298",+7 (894) 969-9477
3841,Соколова Евпраксия Рудольфовна,2017-07-03,Ж,"д. Неплюевка, пр. Циолковского, д. 672, 266675",85637103280
3842,Князева Нинель Георгиевна,2010-08-05,Ж,"к. Апшеронск, ул. Высотная, д. 5 стр. 6, 490187",+7 228 292 9905
3843,София Романовна Юдина,2019-09-25,Ж,"к. Цимлянск, бул. Гаражный, д. 42 стр. 2, 039329",8 187 734 7286
3844,Изяслав Исидорович Князев,2004-03-23,М,"с. Северодвинск, бул. Колхозный, д. 5 к. 62, 616758",8 (460) 002-4418
3845,Алексеев Борис Владиславович,1981-10-02,М,"клх Тикси, алл. Санаторная, д. 52 стр. 339, 425330",+7 (731) 634-91-71
3846,Котова Ангелина Оскаровна,1972-03-22,Ж,"п. Оренбург, ш. 8-е Марта, д. 5 стр. 4/3, 114776",+7 (311) 185-3270
3847,Андрон Александрович Рогов,2011-03-27,М,"к. Киржач, ул. Химиков, д. 39 стр. 7, 885562",85184849568
3848,Наум Данилович Маслов,1973-10-08,М,"п. Воткинск, наб. Ленинградская, д. 7/9, 795192",+7 (831) 517-7010
3849,тов. Турова Лукия Феликсовна,2017-10-29,М,"ст. Нефтегорск (Самар.), наб. Волжская, д. 2/5 к. 9/1, 967257",8 859 797 3532
3850,Федосеев Эмиль Фёдорович,1994-04-17,М,"д. Сызрань, бул. Вавилова, д. 5 к. 8, 854936",8 758 422 15 31
3851,Анастасия Юрьевна Лобанова,2014-09-15,Ж,"д. Листвянка (Иркут.), пр. Кутузова, д. 95 стр. 4, 142400",+7 (718) 253-0986
3852,Прасковья Ниловна Некрасова,2001-08-19,Ж,"д. Верхнее Пенжино, наб. Станционная, д. 6 стр. 4/1, 606334",+7 453 429 71 79
3853,Георгий Валерьянович Субботин,1994-06-26,М,"г. Чебаркуль, ш. Кирпичное, д. 60, 649986",8 (608) 752-21-51
3854,Таисия Аскольдовна Козлова,2016-05-18,Ж,"д. Шерегеш, пр. Крылова, д. 9 стр. 951, 412060",+7 559 794 56 95
3855,Спартак Ефимьевич Герасимов,2019-01-25,М,"д. Сладково, бул. Западный, д. 98, 733445",8 070 102 03 30
3856,Рюрик Филиппович Мартынов,2009-05-26,М,"к. Северодвинск, пер. Профсоюзный, д. 65 стр. 763, 397764",8 753 049 8266
3857,Федосеев Ермолай Фролович,1974-11-25,М,"д. Домбай, пер. Парижской Коммуны, д. 6/1 к. 750, 569756",+7 211 499 22 09
3858,Голубев Кирилл Антонович,2020-05-15,М,"г. Каргасок, бул. Курчатова, д. 95 к. 1/4, 810216",8 (749) 090-5501
3859,Дроздов Гедеон Арсенович,2023-02-23,М,"к. Урай, ш. Саратовское, д. 52 к. 8/4, 568762",+71854907925
3860,Синклитикия Николаевна Колесникова,1979-07-26,Ж,"д. Кемерово, пер. Аэродромный, д. 9/7 стр. 3, 752915",+7 408 092 6999
3861,Борисов Никита Фадеевич,2011-07-14,М,"г. Краснокамск, пр. Партизанский, д. 9/2, 687684",8 (401) 876-67-63
3862,г-н Федотов Николай Евсеевич,2001-12-20,М,"ст. Сузун, пер. Привокзальный, д. 3/6 к. 22, 135758",8 563 546 0622
3863,Щербакова Елена Степановна,1999-10-16,Ж,"ст. Вуктыл, ш. Химиков, д. 92 к. 7/7, 599683",8 780 717 85 74
3864,Гурьева Феврония Васильевна,2010-12-30,Ж,"д. Кежма, наб. Прохладная, д. 39 к. 1/5, 075445",8 875 697 57 93
3865,Ипполит Гурьевич Самсонов,1995-05-30,М,"ст. Чусовой, ул. Макаренко, д. 4 стр. 5, 857906",8 143 416 4321
3866,Фёкла Руслановна Кабанова,2013-08-11,Ж,"г. Тобольск, бул. Физкультурный, д. 4/8, 348336",8 300 819 74 70
3867,Данила Устинович Соболев,2008-07-11,Ж,"клх Мирный, пр. Лермонтова, д. 9 к. 615, 776543",8 701 170 88 94
3868,Андроник Марсович Шилов,1979-04-29,М,"с. Обоянь, пр. Нахимова, д. 1/4 к. 6/1, 200760",+7 (237) 817-88-81
3869,Орест Феодосьевич Комиссаров,1975-03-09,М,"клх Нарым, бул. Иванова, д. 89 стр. 34, 163837",8 (642) 695-42-76
